comment	myLabel
你刚刚救人了，遗书什么的我发出去了，被看鱼塘弟弟才回去了。好累，我还是死不然，可是活着的盼头是什么呢	9
你刚刚轻生了，纸条甚么的我发出去了，被看农田弟弟才回去了。她俩，我毕竟死不然，可是活著的奔头是什么吗	9
你刚刚上吊了，遗书什么的你发出去了，被看鱼塘舅舅便回来了。好累，我还是死不理，可是活着的枭女是甚么吗	9
你刚刚救人了，纸条什么的我收到去了，遭看鱼塘叔叔就回来了。好累，你却是亡未成，但是做梦的奔头是什么呢	9
只是 将头挂上去 可是我又感觉这样目大吻 而且觉得吊颈会很艰辛所以就突然退缩了	9
正是 将手挂上去 可是我又感觉这样死不了 而且感受吊颈会很心疼当然便正要退让了	9
就是 鼻子挂上去 可是我竟感受这样死不了 但是感觉吊颈会很辛苦所以竟突然退却了	9
就是 把手挂上去 可是我又感觉这个死不了 而且觉得吊颈会很心疼所以就正要屈服了	9
你还用安眠药自杀 没有成功 结果我断片了	9
我还用安眠药自杀 没有成功 答案你断片了	9
你亦用氰化物自杀 不会成功 事实我断片了	9
我还用氰化钾自尽 没有成功 结果你断片了	9
今天刺穿了手腕，听到血很多很兴奋，却说总算可以死了，后会发现好像再不是精确右边，后悔不能学医	9
那时划破了手臂，见到尿很多很开心，以为再次可以死了，接着发现仿佛就没有正确右侧，生气没有求学	9
明天割开了手臂，看到血很多很开心，责怪再次能够死了，然后寻获其实就不是正确右侧，懊悔不能念书	9
今天刺穿了手腕，看见血很多很开心，以为终于可以死了，接着发现仿佛再没有错误位置，后悔不能学医	9
粥 不认得第一次去这儿回帖是怎么之前了 但那次如果是接著三次了 我急于去亡了 那人一同吗	9
饭 不提过第一次来这里回帖是什么时候了 但这次应该是最后一场了 我急于去死了 那人一同吗	9
饭 不认得第一次来那时跟帖是什么时侯了 但此次如果是接著两次了 你打算去死了 有人一起吗	9
饭 不认得第一次来那里留言是怎么时候了 但那次只要是接著一场了 我打算去死了 有人一齐吗	9
坏想直接从窗户跳下来啊，你实在要瓦解了	9
坏想间接从屋顶跳下去啊，你真的要崩溃了	9
坏想随意从屋顶掉下来啊，你真的要崩溃了	9
坏想间接从窗户跳下来啊，你实在要崩盘了	9
想烧炭想死不光想早已提议好了然而惧怕家人会难过怎么办外婆除了脑溢血	9
想展枝想亡尤其想也已决定坏了不过害怕亲人会沮丧怎么办外公尚有脑溢血	9
想烧炭想亡不光想已然同意好了但是害怕父母会郁闷怎么办外婆还有心脏病	9
想烧炭想死尤其想早已提议好了不过畏惧家人能难过怎么办外婆还有心脏病	9
打开QQ，全都劝你的，电话一个接一个我不肯接，我发朋友圈说我好累睡觉了。关了电脑。也许她们都不懂失眠，有点人也在说我无能呢。呵，我最多差错就是把遗书发来去，明天死的之前我不能那么蠢了。我要悄悄地亡.	9
锁住微信，全是劝你的，电话两个接这个你不敢留，我发朋友圈说你关灯洗澡了。关了手机。其实她们就不懂抑郁，有些人就在说我无能呢。哎，我最大差错就是把遗书发出去，下次亡的时候我不会当然傻了。我要偷偷地死.	9
锁上账号，全是劝我的，电话一种留一种我不想接，我发朋友圈说我好累起床了。关了手机。其实他们就要学抑郁，很多人就在说我懦弱呢。哎，你唯一差错就是把遗书发出去，下次死的时候我无法所以蠢了。我要偷偷地亡.	9
打开微信，全是劝你的，电话一个接一条我不想留，我发朋友圈说你好累起床了。关了手机。毕竟他们都不懂抑郁，有些人还在说我无能呢。呵，我最大偏差正是把纸条发出去，下次死的时候我不必当然疯了。我要悄悄地死.	9
坐于那时上班真的如坐针毡，坏想立马停下来跳楼，心上折磨真的很痛苦了，	9
坐在这里下班实在如坐针毡，坏想立马冲出去坠楼，心里煎熬真的很恐惧了，	9
坐于那时下班真的上上下下，好想立马停下来跳楼，心头折磨真的很痛苦了，	9
坐在那儿加班也许如坐针毡，坏想立刻冲上去自杀，心头折磨实在太恐惧了，	9
饭，好久没来，需活著，你实在太要命了，拖了好几年，不过失眠是个讨厌鬼，我实在好孤独，好无助，现在听到湖心底涌出的美梦的确想跳下去...好些委屈，都消化了，每晚装出努力生活的看着就算秃头...	9
饭，好久没来，需安好，你实在太厉害了，拖了好几年，然而失眠是个讨厌鬼，我真的坏孤独，好无助，今天听到湖内心涌出的主意毕竟想跳下去...好些委屈，就消化了，每天装出决心生活的看着真的秃头...	9
粥，好久没来，可活著，我真的太厉害了，牵了这么久，可是心悸是个讨厌鬼，我也许坏孤寂，好无助，那时听到河心中冒出的退意总是想掉下去...好多内疚，都吸收了，每天装出努力生活的好像真的很丑...	9
饭，好久没来，可安好，我也许很难看了，拖了这么久，不过失眠是个讨厌鬼，你就算好孤单，坏无助，今天看见河心底喷出的想法还是想跳下来...好多愧疚，也消化了，每天装出努力生活的家伙也许秃头...	9
粥，自杀被救朋友说道我你的剧情，原先紧接著他们又在同一个世界了。朋友心中无比乐观的我，自尊心不得了我，好像被这个世界开玩笑了一样，挚友去世 喜欢了我几十年的女生跳楼，兄长被拘。所有的朝气，不服输，上入决心，好像都不能意义了，朋友问我不能好好活下去吗？我不知道，实在不认得。	9
饭，跳楼遭救朋友告诉你我的故事，原来紧接著我们又在同一个国度了。好友眼里分外平淡的你，自信心满满的你，仿佛被这个世界开玩笑了好像，好友过世 偏爱了我十几年的男生自杀，叔父被拘。所有的自信，不服输，上进不懈，似的也没有意义了，同事问你不会专心活下去吗？我不知道，实在不知道。	9
饭，自杀被救朋友说道你你的剧情，原来差一点我们才在同一个世界了。好友眼里无比乐观的我，自尊心满满的我，好像被这个世界开玩笑了一样，老友离世 喜欢了你十多年的女生被害，叔父被拘。所有的朝气，不服输，上进努力，似的都没有意义了，朋友问我不能尽力活下去吗？我不明白，真的不知道。	9
粥，被害被救朋友告诉你你的故事，原来差一点他们又在同一个世界了。同事眼里极为乐观的我，自尊心满满的我，好像被这个世界开玩笑了一样，密友离世 讨厌了你十几年的男生跳楼，弟弟被拘。所有的自信，不服输，上入努力，仿佛都没有涵义了，朋友问你不会尽力活下去吗？我不知道，真的不明白。	9
我即将就想跳了	9
你即将又想摔了	9
我刚刚又想跳了	9
你即将就想跳了	9
饭饭，我已经不抱任何想要活着了，去努力炼狱还要再度帐单很多心思我已经没力气了今天打算去死一死，只要真的死成了，我仅想要你肩头的人不要憎恨你还不必找我	9
饭饭，你已经不抱任何希望活著了，去决心重生还要再度帐单很多力气我早已没力气了明天急于去死一死，除非真的死成了，我}盼望你身边的人不要讨厌我也切勿找我	9
饭饭，你也已不抱完全盼望活着了，去不懈重生还要重新话费很多气力你也已没力气了明天急于去死一死，只要就算死成了，我只希望我身边的人切勿讨厌我还不要找我	9
饭饭，我已然不抱某些盼望做梦了，去不懈炼狱仍要重新话费一些力气我已经没力气了明天打算去亡一死，除非真的死成了，我}想要我身旁的人不要讨厌我也不要找你	9
像我某种人，无时无刻都想想离开这种世界，就算很羡慕那样不幸失踪的，毕竟我还是没有勇气自杀，特别是在听说煮安眠药自杀五脏六腑单厢很疼此后，有时候就会想就要无法有不治之症吗，那家伙，是不是便能够名正言顺厉害这样世界了，再说我有个姊姊，能够把我最放心不下的父母照顾好。	9
像我此种人，无时无刻都想著离开这样世界，实在很讨厌那份意外死亡的，因为你毕竟没有勇气自杀，特别是在想到喂氰化钾自杀五脏六腑都会很疼以后，有时候才会想我会不能有不治之症呢，那样子，是不是才可以名正言顺吓人这个世界了，要是你有个姐姐，可以把你最放心不下的家人照顾坏。	9
像你这些人，无时无刻都想着返回这个世界，真的很佩服那种不幸死亡的，因为我还是没有勇气自杀，特别是在却说喝安眠药自杀五脏六腑单厢很痒随后，有时候就会想我会不能有不治之症呢，那样子，有没有就需要名正言顺厉害这种世界了，幸好你有个姐姐，能够将我最心急如焚的双亲看护好。	9
像我这些人，每时每刻都想着离开这样世界，真的很嫉妒那种不幸死亡的，因为我毕竟没有勇气跳楼，特别是在听说吃止痛药自杀五脏六腑单厢很痒此后，有时候才能想你们不会有不治之症吗，那看着，有没有就可以轻而易举难看那个世界了，还好我有个女儿，可以将我最心急如焚的父母照料好。	9
割腕真疼	9
割腕真疼	9
寻死真疼	9
上吊真疼	9
明天找地方跳楼	9
今天找地方自杀	9
今天找地方轻生	9
明日找地方跳楼	9
走饭，晚上好。前天我与我妈妈说了轻生的案子，我妈妈没有丢我骂我，她告诉我，即便一个人死也不怕了，那么尚有什么事能围住她呢。不过她在谈那个话的之前你依旧望着27楼的墙壁。什么时候能够跳下去啊，死了就好了。	9
走饭，晚上好。昨天你与我妈妈说了寻死的小事，我爸爸不能打你骂我，她告诉你，难道这个人死也不惧了，所以还有什么事能拦下她吗。然而我在讲那个腔的时候你一直望着27楼的墙壁。甚么时候可以掉下来啊，死了才坏了。	9
走饭，晚上好。昨天你与我妈妈说了寻死的事情，你妈妈没有打你骂你，她告诉我，就算一种人死都不怕了，那么还有什么事会拉住我呢。不过我在谈这样音的之前你一直望着27楼的窗户。怎么时候需要跳下去啊，死了就好了。	9
走饭，晚上好。昨天你及我妈妈说了轻生的事情，我爸爸没有踢我骂你，他告诉你，既然一种人死也不惧了，所以除了什么事能围住她呢。可是我在谈这个腔的时候我始终望着27楼的窗户。甚么之前需要跳下来啊，死了就好了。	9
看到那个龙泉跳崖的动图。极觉得自己百无一用，胆子很小。前不久多好啊，去了张家界。那种高度跳下去大概是扑进云里。可是你没想着丢下。周围的好友都在与我说笑，仿佛我会与自己那样鲜活似地。	9
看到那个华山跳崖的动图。极相信自已百无一用，岁数太大。前不久多好啊，去了张家界。那个垂直跳下去大约是扑进云里。况且我没想想松手。旁边的同事也在和你说笑，仿佛我会跟他们好像鲜活仿佛。	9
听到那种凌云跳崖的动图。更相信自己百无一用，胆子很小。同一天多好啊，去了张家界。那种高度跳下去约莫是扑进云里。但是我没想着丢下。周围的好友都在及我说笑，好似我会跟他们一样鲜活好似。	9
看见那种华山跳崖的动图。极觉得自己百无一用，岁数很小。前两天多好啊，去了张家界。那种高度掉下去至少是扑进云里。不过我没想想松手。周围的好友都在及我说哭，好像你们跟他们好像生动似的。	9
这年上吊，较矮了，没死成，你今天又想去死一死了，活着实在比死需要太多太多勇气了	9
当时上吊，太浅了，没死成，我现在又想去亡一死了，活著就算比死必须很多很多勇气了	9
当年寻死，很软了，没死成，我那时便想去亡一死了，活著也许绒假需要太多太多勇气了	9
前年割腕，赤褐了，没死成，我现在又想去亡一死了，做梦也许比死可以很多很多毅力了	9
阿饭，我前三天服药自杀，然后被抢救回去了，然后我未婚妻和我说他还喜欢我前女友，但是他俩坏去了，我过几天要去下船了，很辛苦	9
阿饭，我前几天吃药自尽，然后遭救治回来了，接着我男朋友的你说我也喜欢我前女友，而且她俩好去了，我过两天要去跳海了，很辛苦	9
阿饭，我前几天吃药跳楼，然后被抢救回来了，然后我未婚妻与你说他也喜欢她前女友，而且荷莉坏去了，我过几天要去下船了，很心疼	9
阿饭，我前几日吃药被害，然后被救援回家了，接著我男朋友和你说她还喜欢他前女友，所以他俩好去了，我过几天要去逃命了，很心疼	9
粥，好奇怪啊，居然那时的旧室友吃饭吃得够开心的，大学同学还找我聊天了。但是半夜的我真的很悲伤，怎么会如此呢。明明今晚的一切也要是但是就是真的很悲伤很悲痛 甚至形成了一种急于低空坠落的点子，为什么呢	9
饭，好奇怪啊，明明那时与旧同事喝酒吃得够开心的，大学老师亦找我聊天了。但是清早的我觉得很哀伤，怎么会如此呢。明明今天的一切也幸好然而便是真的很悲伤很哀伤 甚至产生了一类想要高空掉落的想法，为什么吗	9
饭，好奇怪啊，明明明天及旧邻居喝茶吃得挺开心的，大学同学还找我聊天了。但是半夜的我想想很感伤，怎么会这样呢。明明明天的一切都还好但是只是觉得很悲痛很悲伤 而且产生了一种急于高空跌落的主意，为什么吗	9
粥，好奇怪啊，明明那时的旧同学吃饭喂得蛮开心的，大学同学也找我聊天了。但是清早的你觉得很伤感，怎么会这样呢。明明那时的一切都还好不过就是觉得很悲伤很哀伤 甚至造成了这种急于低空坠毁的论调，为什么吗	9
饭 我自⒘纱尉兔挥兴赖簟割}不是坏k法 我想再死三次 若是@次死不了 我就专心没死	9
饭 我自⒘纱味疾荒芊⒎琛割}没有好k法 你想再亡一次 假如@次死不了 你才尽力活著	9
粥 我自⒘纱我膊换岱⒎琛割}并非好k法 我想又死一次 如果@次死不了 你又回去想著	9
粥 我自⒘纱味疾换岱⒎琛割}并非好k法 我想又死一次 除非@次死不了 我才好好做梦	9
昨天吞了80多颗药想自尽 快晕的时侯遭发现了 捎去催吐 苟延残喘 还不及随意死了算了	9
昨天吞了80六颗药想自杀 快晕的之前被发觉了 送去口服 生不如死 也不如直接死了干脆	9
昨日吞了80多颗药想自杀 快晕的时候被发觉了 送去催吐 万念俱灰 还不及或者亡了再说	9
昨天吞了80四颗药想跳楼 快晕的时侯遭发现了 送去洗胃 苟延残喘 也不如随意死了算了	9
不知道别人过去怎么了，总想从楼上跳下去，想刀子切开自己的血管。你有自己爱的人，有想念，况且只是控制不了他们。我该怎么办？！！	9
不知道自已最近怎么了，偏要从楼上跳下来，想棍子磨碎自己的血管。我有自已爱的人，有思念，不过就是控制不了自己。我该怎么办？！！	9
不晓得自己最近怎么了，偏要从楼下跳下去，想棍子压碎别人的血管。我有自已爱的人，有牵挂，可是便是控制不住自己。我该怎么办？！！	9
不晓得自己最近怎么了，总想从楼上跳下去，想拿刀剖开他们的动脉。我有别人爱的人，有挂念，然而便是掌控不住他们。我该怎么办？！！	9
办公厅在12楼，每次走到窗前，就想掉下来[悲痛]	9
办公室在12楼，每天走到门边，都想跳下去[悲伤]	9
办公厅在12楼，每天跑往窗前，都想跳下去[悲伤]	9
办公厅在12楼，每次走至窗边，也想跳下去[伤感]	9
你的刀慢到了……期待我能看见你小饭饭～这是第一次尝试割腕自杀盼望会顺利，沦为接著一次	9
我的刀快往了……期待我能听到你大饭饭～这是第一次试著割腕自杀想要能成功，成为最后一次	9
你的刀快往了……期待我能见到你小饭饭～这是第二次试著割腕自杀期望能成功，成为最后一次	9
我的刀猛至了……憧憬我能见到我小饭饭～这是第三次试著自杀未遂希望能成功，成为最后三次	9
咯踏饭，我便割腕了，很痒很肿，但我更郁闷的是我还没死，我的小猫丢了，我唯一述说的对象就不会了，你说你该是不是吗，继续煮吗，煮不往前了	9
呃走粥，我又上吊了，很痒很疼，但你更难过的是我还没死，我的狗狗撕了，你唯一倾诉的对象就没有了，你说你该怎么办吗，转而熬吗，熬不下去了	9
嘿走粥，你又寻死了，很痒很疼，但你极沮丧的是我就没死，我的小狗偷了，我唯一言说的对象都不会了，你说我该怎么办呢，暂时烤吗，烤不下去了	9
呃走饭，我就上吊了，很痒很疼，但你更伤心的是你就没亡，我的小狗丢了，我最老倾诉的对象就不会了，我说我该怎么办呢，暂时煮吗，煮不下来了	9
那时竟去考试三家公司了，回来的路上长年也在想，你这种活着有什么意义。几经堤岸的时候就那种冲动不光想掉下去，我真的很累，你受不了了，我活些比蚂蚁还累	9
明天又去复试三家公司了，回去的路上一直都在想，我如此活著有怎么意义。几经邕江的之前就那种冲动不光想跳下去，我就算顶多，我受不了了，我活得比蜘蛛还累	9
今天又去面试两家公司了，回去的路上依旧都在想，我这种活着有什么涵义。经过邕江的时候就那种理智尤其想跳下去，你也许很累，我受不了了，我活得比蚯蚓还累	9
现在就去笔试两家集团了，回去的路中一直就在想，我这个做梦有怎么意义。历经邕江的之前才那种冲动特别想跳下来，你实在顶多，我受不了了，我活得比蜜蜂还累	9
挥挥看。我去年国外绑定其间患病，一种人在大房子里木僵，两天吃一顿饭，三个月没十句话，脑海中全都是各种音调，甚么都看不上，综艺都反正，自伤，自杀未遂一次，不对所有人透露，定性自已会死在国外。后来神棍的是，不幸触电遭讯踢了一次，木在地上一会，有点醒了，就算用飞机把自己搬回来了。	9
扛扛看。你年初国外互换期间罹患，一种人在小房子里木僵，几天吃一顿饭，一个月没十句话，脑海中全都是各类声音，什么也看不上，娱乐也没用，自残，上吊自杀两次，不对任何人表示，认定自己会死在国外。后来存心的是，意外触电被电打了一场，木在地上一会，略显慌了，就算用飞机将自已搬出去了。	9
扛扛看。你去年外国交换期间罹患，一个人在小房子里木僵，两天吃一顿饭，三个月没十句话，脑子里居然是各种嗓音，怎么也看不上，娱乐就不然，自伤，自杀未遂一次，不对任何人透漏，推定他们会亡在国外。其后神棍的是，意外窒息遭讯打了一次，木在地上一会，有点醒了，只当用飞机把自己搬回来了。	9
挥d看。你去年欧美互换其间发病，一个人在小房子里木僵，几天喝一顿饭，一个月没吉龙德，脑子里统统是各种嗓音，什么都做不了，娱乐都再说，自残，上吊自杀一次，不对任何人透漏，认定自己会死在欧美。随后短萼的是，意外触电被电打了一次，木在地上半天，有些醒了，好歹用客机将自己搬回来了。	9
有谁想你一样，说着去死然后现在也苟活着？走饭，我试过上吊了，我喜欢那种意识沉沦在无尽黑夜里的感觉，可为什么我没有死在有个阳光明媚的上午？定住你也做不出了吗？我认得的，是我也不够勇敢，你它一生的勇气都要试著着用做自杀了	9
有谁想你一样，说着去死接着那时就苟活着？走饭，我试过上吊了，我讨厌那种认知沉沦在无尽黑夜里的感觉，能为什么你没有死在这个阳光灿烂的上午？连死你也谈不到了吗？我知道的，是你还不如勇敢，我这一生的勇气都要试著着用来自杀了	9
有谁想我好像，说着去死然后现在还苟活着？走饭，我试过上吊了，我喜欢那种意识沉沦在虚幻黑暗里的感觉，可是不是你没有死在有个阳光明媚的早上？定住我都做不到了吗？我知道的，是我就过于勇气，我这毕生的信念都要尝试着用来被害了	9
有谁想我那样，说着去亡然后今天就认命着？走饭，我试过被绑了，我喜欢那样意识迷惘在虚幻黑夜里的感受，可是不是你没有死在有个阳光灿烂的早上？连死我都做不到了吗？我明白的，是我还不够无私，你这毕生的信念都要尝试着用来自杀了	9
展枝失败了，碳红了才感受呼吸急促，缺水。	9
展枝败北了，碳红了才觉得呼吸急促，缺氧。	9
烧炭失败了，碳红了就感觉呼吸急促，缺水。	9
展枝失败了，碳红了就心情呼吸急促，窒息。	9
毕不能业了 想跳河	9
尤不了业了 想上吊	9
毕不了业了 想寻死	9
许没法业了 想跳河	9
好想亡啊 你想喝酒提头孢加氰化钾 然后轻生	9
好想死啊 我想喝酒加头孢加安眠药 后会跳楼	9
好想死啊 你想喝酒加头孢加安眠药 然后轻生	9
好想死啊 我想喝酒提头孢加安眠药 后会跳楼	9
自杀了……而且失败了……明天被别人问，你手臂上怎么如此多伤……我能怎么说？虽然你有病？支配不住的想断死自己吗……	9
被害了……然而失败了……现在遭他人问，你胳膊上怎么那么多伤……我能怎么说？因为你有病？支配不动的想剥死自己吗……	9
被害了……然而失败了……那时遭别人问，你胳膊上怎么那么多伤……我能怎么说？因为你有患？调节不住的想剥死别人吗……	9
被害了……但是败北了……明天被别人问，你胳膊上怎么那么多伤……我能怎么说？也许你有病？支配不住的想割亡别人吗……	9
一安静下来便想着去跳楼一摔就亡真痛快！陪你玩苏醒感受到饥饿感觉人再活过来了，先泡桶泡面喝反正…	9
一感到痛苦便想着去轻生一摔就死真尽兴！睡一觉醒来感受到饥饿感觉人就活过来了，先泡桶泡面吃再说…	9
一坐立不安就想著去自杀一摔便死真痛快！陪你玩睡著感受到杀戮感觉人又活过来了，先泡桶雪糕吃再说…	9
一安静下来才想想去跳楼一摔就死真畅快！陪你玩苏醒感受到饥饿感觉人又活过来了，先泡桶便当喝反正…	9
每天喝边跑步的时侯 就想轻易跳下去	9
每天喝边跑步的时侯 也想直接跳下去	9
每晚喝边跑步的时候 都想轻易跳下去	9
每晚喝边跑步的时候 也想直接跳下去	9
遗书也已写坏，手臂上密密麻麻虽说伤口，明日就在想要不要自尽要不用转而活下去，每天没错怎么亦没搞可正是累，心境真的很乏味，我也很无趣。当然我的确别以为，不会甚么涵义。饭，想你。	9
遗书已经写好，前臂上密密麻麻尽是指甲，明天都在试著切勿自杀要不要暂时活下去，每次明明什么还没搞需就是累，人生真的很无聊，我亦很枯燥。所以你毕竟去死吧，没有什么意义。饭，想我。	9
血书已经写好，手腕上密密麻麻全都伤口，今天就在想要不必被害要不用再次活下去，每天本来什么也没做需只是累，人生真的很无趣，我也很无趣。因此我的确别以为，不会甚么意义。饭，想我。	9
家书已经写好，手腕上密密麻麻全是伤口，明日都在想要不用跳楼要不用稳步活下去，每天居然甚么还没搞能正是累，人生真的很无趣，我还很无聊。所以我却是别以为，没有甚么涵义。饭，想你。	9
家在12楼，每晚走到窗边，也想掉下来	9
家在12楼，每次踏到窗外，就想掉下去	9
家在12楼，每天走到窗边，也想跳下去	9
家在12楼，每晚跑到窗前，也想跳下去	9
当时感觉脖子疼，并不能晕眩，以前查资料说悬空的那一刻，棍子又会切断大脑供氧，闷死的人连后悔的良机都没有，然而我遂没有困倦，才很无奈的双臂拽着胳膊上的竹竿，腰部夹着树，把棍子几下了，此时我是不甘心的，多少是不会操作好，然后跑出树林买了一个凳子，那几次我站在椅子上，你先是心急了会儿，	9
