comment	myLabel
那时感觉脖子肿，并不会晕眩，以前查资料说半边的一瞬间，棍子就会阻塞小脑供氧，上吊的人连后悔的良机都没有，然而我便不会晕眩，便很无奈的双手拽着脖子上的绳子，腰部夹着树，将铁链拿开了，那时你是不甘心的，较大是不能操作好，后会跑出山谷买了一个凳子，这一次你站在凳子上，我先是心急了一会，	9
此时感受脖子疼，并不能眩晕，之前查资料说断掉的那一刻，绳子就会切断大脑失压，闷死的人连后悔的机会也不会，可是你便不会疲倦，就很无奈的双脚拽着脖子上的绳索，小腿夹着树，将铁链几下了，那时我是不甘心的，一定是没有操作坏，接着跑出山谷买了一个凳子，它两次我站在茶几上，我先是迟疑了一会，	9
当时感觉额头痒，并没有疲倦，之后查资料说断掉的一瞬间，棍子便会截断大脑失压，上吊的人连内疚的良机都不能，然而我并没有疲倦，才很郁闷的双手拽着脖子上的竹竿，双脚夹着树，将铁链拿开了，那时你是不甘心的，一定是没有操作坏，然后跑出山谷买了一个椅子，这一次我站在茶几上，我旋即犹豫了一会，	9
最近因为自杀可能就出现恐惧了，尤其便看了量子自尽这个词条，又感觉自已可能真的搞不好？我爸死了四个月后我第一次试著跳楼，此时是抱着必死的勇气的，我挑选在一片茂密树林，被绑的绳子打的是活扣就是愈彷徨越紧那种，我脚踏在石头上，用力拖开，人开始往上，绳索直到收紧大概泥潭几分钟吧，当时感觉	9
近来即使自杀如果也出现幻觉了，尤其又看了物理跳楼这个词典，又感受自已可能也许目大吻？我爸死了六个月后你第三次尝试自杀，当年是抱着必死的决意的，我挑选在一阵繁茂树林，被绑的棍子打的是活扣就是愈彷徨越快有种，我脚踏在石头上，用力滚开，人开始悬空，铁链开始放松大概挣扎几分钟吧，此时觉得	9
最近因为自杀如果都出现幻觉了，不光又看了光子被害这些条目，就觉得别人可能真的搞不好？我爸死了三个月后你第四次试著自杀，当年是抱着必死的定力的，我选取在一片繁茂树林，上吊的绳子打的是活扣正是愈绝望越紧那种，我脚踩在巨石上，双脚铲开，人直到断掉，绳子开始趋紧至少挣扎几秒钟吧，当年觉得	9
近来因为被害显然都出现梦境了，特别又看了光子自杀这些词条，才感觉自己显然实在搞不好？我爸死了五个月后你第一次尝试自杀，那时是抱着必死的决心的，我选择在遍地茂密树林，被绑的绳索打的是活扣就是越泥潭太紧那种，我脚踩在泥土上，拍打蹬开，人直到半边，绳子开始趋紧约莫挣扎几秒钟吧，彼时感受	9
阿 你昨天想坠楼的 在栏杆从三点做到六点半 好高啊 我一个人 也许总是挺怕的 就是 感觉他们一种人啊 腿也软了 我还是不肯跳 对着天黑 便从上面下去了 不该被见到啊	9
阿 我昨天想跳楼的 在窗台从几点作到六点半 坏高啊 我两个人 也许的确挺怕的 就是 感觉自己一个人啊 腿也软了 我的确不许跳 看着夜里 就从下面出来了 没法被看见啊	9
纳 你昨晚想自杀的 在阳台从两点达致十一点 好高啊 你一个人 也许还是挺怕的 便是 觉得自已一个人啊 腿都软了 我的确不敢滚 对着天黑 就从前面下去了 没法被看见啊	9
纳 你前日想坠楼的 在窗台从四点作到六点半 坏差啊 我这个人 也许却是挺怕的 只是 感觉别人两个人啊 腿都软了 我还是不肯冲 看着天亮 又从里面下来了 不想被听到啊	9
今天却是心情好痛，昨日差一点点就跳下去了，假如没防护栏又坏了	9
现在还是心情好痛，昨天少一点点就掉下来了，假如没防盗网又好了	9
现在还是感受好痛，昨日差一点儿便跳下去了，假如没防护网便坏了	9
现在还是感觉好痛，昨天高一点儿才跳下去了，如果没防盗网便坏了	9
你亦刚粘冠，而后割腕了	9
你也刚GG，然后上吊了	9
我还刚粘冠，然后上吊了	9
你也刚GG，接着割腕了	9
今天还是烦躁，晕晕沉沉的，皮肤亦痛，听了一天的圣经，刚刚外面滂沱大雨的，锁上窗户的之前有跳下去的病态，墙壁为什么要装防盗网	9
明天毕竟头痛，晕晕沉沉的，腿部亦恨，听了两天的经文，才刚旁边雷电交加的，打开窗户的之前有掉下来的理智，窗户为什么要装防盗网	9
现在总是头痛，晕晕沉沉的，腿部也恨，哭了一天的经文，才刚外边滂沱大雨的，锁上窗子的时候有掉下去的贪婪，窗户是不是要装防盗网	9
今天的确头痛，晕晕沉沉的，乳房还痛，听了一天的经文，刚刚外面电闪雷鸣的，关上屋顶的之前有跳下去的欲望，窗户是不是要装防护栏	9
喝安眠药自杀也很难过 我试过	9
吃安眠药自杀亦很难受 我试过	9
喝止痛药自杀亦很郁闷 我试过	9
煮安眠药跳楼还很不爽 我试过	9
昨晚割腕失败了，今天上午自杀去	9
前天寻死失败了，今天上午跳楼去	9
前天上吊失败了，今天上午坠楼去	9
昨晚割腕失利了，今天下午坠楼去	9
