comment	myLabel
食物。奇怪的是他能回来。虽然我现在什么都没有，但我已经计划好了。昨天他恳求有一天他不能做他想做的事。我不想找到更多的理由和动力，我太累了。看着他的绝望，也许他没那么难过。我害怕去一个没有它的世界，我很想看到它。范，给我点勇气。死没什么大不了的，是吗？痛苦和斗争太不舒服了。我们见面时我能抱着你吗？	3
晚餐。我希望她回来。虽然我现在什么都没有，但我已经计划好了。昨天我恳求有一天没有成功。不要再寻找理由和动力了，累了。看着她坠入爱河，也许她不会那么伤心。我害怕进入一个没有她的世界，我想见到她。吃饭，给我勇气。死亡并不严重，不。疲倦和挣扎太难了。我们见面时我能抱着你吗？	3
一顿饭。我认为她可能会回来。虽然我现在什么都没有，但我已经计划好了。昨天我乞求了一天。我不想找到原因和动机，太累了。在爱情中看着她可能不会太难过。我害怕没有她去世界，我想见她。大米，给我一些勇气。死亡不是什么大事，是吗？苦难和斗争非常困难。我们见面时我可以带你吗？	3
米饭。我希望她回来。现在的我什么都没有，但是我已经计划好了。昨天一天愿望没有实现。我不想再找理由和动力了，我累了。看着她的无情，她可能就不会那么伤心了。我害怕去没有她的世界，我想见她。饭，请给我勇气。死了不就好了吗。痛苦的灯火很痛苦。我们见面的时候我能拥抱你吗。	3
为了积累离开这个世界的勇气，我们还要经历多少次悲伤？我希望这一天很快到来	3
还要经历多少次悲伤才能节省死亡的勇气？我希望这一天很快到来。	3
为了有勇气离开这个世界，你还需要经历多少次悲伤？希望这一天来得早	3
毕竟，为了挽救足够的离开世界的勇气，你应该多久经历一次悲伤？我希望这一天能早点到来。	3
到底经历了多少次悲伤，才能积蓄离开人世的勇气呢。希望这一天快点到来啊	3
即使我能在冰天雪地中生存，能在茫茫人海中沉沦，能把孤独的心藏起来，能不能拥抱它温暖我，死亡不是终点，而是另一个世界的新开始。孤独，孤独，寂寞，无法理解，心里有一个声音在拉我，我的理性是有限的，我很难控制这个恶魔。他正在引导我一步一步地离开这个世界，	3
即使你能在一个冰雪覆盖的世界里生存，沉浸在一片茫茫人海中，隐藏一颗孤独的心，拥抱取暖，死亡不是结局，而是重新开始在另一个世界里，孤独，孤独，不可理解，我内心深处有一个声音在拖累我，我的理智是有限的，我无法控制这个恶魔，它一步一步地引导我离开这个世界，	3
即使冰冷的人可以生存，沉入空虚的人的海洋，隐藏孤独的心，亲吻，如果他能温暖自己，死亡不是结束，而是另一个世界的新开始，孤独，孤独，难以理解，内心深处有一个声音在拉着我，我的理性是有限的，我很快就无法控制这个恶魔，一步一步地引导我走出这个世界，	3
即使在冰雪世界中，你也可以生存，淹没在人海中，隐藏孤独的心，拥抱炎热，死亡不是尽头，而是在另一个重新开始的世界中，孤独、孤独、孤独，我们无法理解，我心中有一种声音在拉着我有限的思想，我无法控制这个魔鬼，他逐渐引导我走出这个世界，	3
即使冰天雪地中的人类能否生存，是否能沉入茫茫人海中，隐藏孤独的心灵，拥抱取暖，死亡不是终结，而是在另一个世界重新开始，孤独，孤独，无法理解，心底有牵引我的声音，我的理性有限我不能马上控制这个恶魔，他一步一步地引导我离开这个世界	3
保护自己很难，我不想让周围的人担心我。跟着我，	3
我不能保护自己，更不用说我想让我周围的人关心我并跟随我。	3
我自己也有麻烦，更不想让周围的人担心，跟我来，	3
很难保护自己，但也不想让周围的人担心，跟随我，	3
不能保护自己了，更不想让周围的人担心我，跟着我	3
我想死，但不敢死。真的很痛苦。有人能帮我吗	3
我想死，我不敢死，真的很痛苦，谁能帮我？	3
死了，不敢死，真的很痛苦，谁能帮助我	3
我想死而不敢死，真的很痛苦，谁能帮助我？	3
想死想死，真难受，有人能帮帮我吗。	3
哦，离开这个世界对我来说是一种解脱	3
嘿，离开这个世界对我来说是一种解脱。	3
离开这个世界对我来说是一种解脱。	3
离开这个世界就是解放我啊	3
离开这个世界对我来说是一种解放	3
活到现在太累了我不知道我活着是为了什么直到现在我不知道活着意味着什么想离开这个世界但我觉得现在我还不能死我真的很累[悲伤]愿生活仍然给我带来希望	3
我厌倦了活到现在。。。我不知道我为什么活到现在。。。我不知道生活意味着什么。。。他想离开这个世界。。。但我觉得现在。。。你不能死。。。我太累了。。。[悲伤]愿生活给我带来希望	3
到目前为止，生活很累。。。不知道你现在生活的目的是什么。。。完全不知道活着意味着什么…想离开这个世界。。。但我仍然觉得我现在。。。还不能死。。。真的很累。。。[悲伤]生活仍然给我希望	3
生活就像一盒巧克力，你永远不知道会发生什么。我不知道为什么我现在活着。我不知道活着意味着什么。我想离开这个世界。但现在我觉得他不会死。我很累。生活可以给我带来希望	3
活到现在好累啊…完全不知道自己是为了什么而活到现在的…完全不知道自己活着的意义…想离开这个世界…但是现在。。。还不能死…真的很累…[悲伤]希望活着能给我希望	3
我也想死，但我没有勇气。	3
我也想死，但我没有勇气。	3
我也想死，但我没有勇气。	3
我想死，但我没有勇气。	3
我也想去死，但是没有勇气。	3
我们去吃晚饭吧。你见过今天从长栈道上跳下来的那个男孩吗？我也松开了绳子，但我不敢跳。我们去吃饭吧。你认为跳下去的男孩会高兴和松一口气吗	3
我们去吃饭吧，你看到今天从长廊上跳下来的那个男孩了吗？我也松开了绳子，但不敢跳。我们要吃饭了，你说跳下去的孩子会很高兴和放心。。。	3
晚餐，你看到今天跳上小径的男孩了吗？我也松开了绳子，但不敢跳。晚餐，你说跳下去的男孩会很高兴和松一口气。。。	3
今天步行去吃晚饭，你见过那个从走廊里跳下来的男孩吗？我松开了绳子，但我不敢跳。如果您对此有任何其他信息，请免费添加。	3
我们吃饭吧。你看见今天跳下长条栈道的那个男孩了吗。我也松开过绳子，但是我不敢跳。吃饭吧，跳楼的男孩说他会很高兴被释放吗…	3
我想死，但我不敢死。我还没有实现我一直想要的生活，我不能死。我经常因为很多事情而产生杀死世界上所有人的想法，有时我真的疯了，忘记了我的意识。然而，我从来没有做过坏事，我的心仍然很善良。我一直相信，总有一天我会给我爱的人和家人更好的生活，而不是让他们为我受苦！	3
想到死，我不敢死，我没有过我一直想要的生活，我不能死。由于很多事情，经常有杀死世界上所有人的想法，有时他真的疯了，忘记了良心，但我还没有做过更糟糕的事情，心仍然特别善良，我一直相信有一天我可以给我的爱人，我的家人一个更好的生活，不让他们为我受苦！	3
我想死，不敢死，我一直想要的生活，我还没有，我不能死。经常有一种想法，因为很多事情而杀死世界上的每一个人，有时真的很疯狂，疯狂地忘记了良心，但我仍然没有做任何不好的事情，心总是特别善良，我一直相信有一天我一定会给爱人、家人带来更好的生活，而不是让他们为我受苦！	3
我想死，但不敢死，我一直想生命没有做，我不能死。很多时候，因为有很多事情想杀死世界上的每个人，有时真的疯了，疯子忘记了意识，但我仍然没有做坏事，或者心脏很好，我总是认为我会有一天一，我当然可以给爱、家庭、更好的生活，不要让他们为我受苦！	3
想死，也不敢死，我一直想要的生活还没有做好，我就不能死。总有想为了很多事情杀全世界所有人的想法，偶尔真的疯了，疯了忘记了意识，但是我还没有做过比较坏的事情，心还是很善良的吧，我一直相信自己会有那样的一天。我一定会给所爱的人、家人更好的生活，让他们不为我操劳！	3
吃饭的时候，我也觉得生活真的太辛苦了。你在另一个世界感觉更好吗？有时我很钦佩你，有时我甚至没有勇气去死，但我真的对生活绝望了	3
食物，我也认为生活真的太难了，你在另一个世界更好吗？有时我对你感到非常钦佩，有时我甚至没有勇气去死，但我真的对生活感到绝望。	3
吃饭，我也觉得活着真的太难了，你在另一个世界吗，有时你感到被钦佩，有时我甚至没有勇气去死，但我真的对生活感到绝望。	3
生活就像一盒巧克力，你永远不知道会发生什么。	3
饭，我也觉得活着真的很辛苦，你在另一个世界有没有好一点，有时很佩服你，我有时连死都不敢死，但又对生活真的绝望	3
我总是无法控制我的心，因为它太疼了，我的大脑也累了。我想找份工作。对我来说会更好吗？我非常后悔我的饭。今天，我姐姐问我，如果我找不到工作，还有其他办法吗。我告诉她我只想死。对不起，我不能控制自己的手说那样的话。我不是想让他们对我感到不舒服。你明白我的意思吗	3
我总是无法控制自己的心，因为我的大脑太痛了，我太累了。我想找份工作。我对这顿饭很后悔。今天，我姐姐问我是否能找到另一条找到工作的路。我告诉他我会死的。我深感遗憾．我不能控制自己的手说这样的话。我不想让他们对我感到不舒服。你懂我的意思吗？我明白。	3
我仍然无法抑制我的心，因为太多的痛苦在我的头上太累了我想找工作如果我会好一点，晚餐我很抱歉，今天我妹妹问我什么我找不到其他工作的路，我告诉她我要死了，我很抱歉我无法控制我的手撞到了这样的东西，我不想让他们让我不舒服，晚餐你明白我，这是理解的	3
我总是无法帮助控制心脏，因为大脑也非常痛苦或疲倦，我想找到一份更好的工作，一顿饭，我很抱歉，今天我姐姐问我我的工作找不到出路，我告诉她，我死了。没关系，他们负担不起，他们无法控制自己的手来玩这样的话，我不想让他们和我的国家在一起意味着不愉快，这是我理解的一顿饭	3
我总是抑制不住自己的内心。不管头痛还是疲惫，我都想找到一份工作，但我会不会好一点。饭我很后悔。今天姐姐问我找不到工作，我跟她说我死了就好，对不起。我控制不住自己的手。我不是让她们和我一起痛苦的意思。饭你认识我吗。明白了吧。	3
晚饭后，我爱上了一个女孩，她觉得自己这辈子有缘。她对我说：“等我死了。”我真的很想知道死后是否还有另一个世界。如果有的话，你能梦见我吗？我们去吃晚饭吧。我真的很想见你。我觉得一切都很无聊，世界也没有意义。我该怎么办？我也应该死吗	3
在吃饭的路上，我爱上了一个女孩，尤其是那个我觉得命中注定要过这种生活的人，她对我说：当我死的时候。你想知道当你死的时候还有另一个世界吗？如果有，你能相信我的梦想吗？在吃饭的路上，我很想见到你，我是一个觉得自己对做任何事情都没有兴趣，这个世界没有意义的人，我该怎么办？我应该死吗？	3
我喜欢一个女孩的晚餐，我特别喜欢这种生活注定的感觉，她和我说：“当我死的时候。”你想知道还有另一个死亡的世界吗？如果是，你能为我梦想吗？吃饭，我想见你，我是一个不觉得做任何事有趣的人，认为这个世界没有意义，该怎么办，我也应该死吗	3
吃饭时走路，我爱一个女孩，尤其是这样一种注定的生活，她告诉我：当我死的时候。我想知道是否还有另一个世界，如果是这样的话，可以将梦想委托给我吗？去吃晚饭，我想见你，我认为没有什么值得注意的，我认为这个世界毫无意义，我该怎么做，我不应该死	3
吃了饭，我爱上了一个女孩，尤其是喜欢感受这一生的命运，她告诉我：当我死了。我想知道死后会有另一个世界，如果有的话，你能把梦想托付给我吗。吃饭了，想见你，我做什么都觉得没意思，这个世界是一个没有意义的人，怎么办，我不也应该死吗。	3
晚饭后，这将是值班，但我还是想离开，离开这里，离开这个世界。拿着微薄的薪水做着重复性的工作，现实中却没心没肺地笑着。里面，脸上没有表情。。。然而，我还是要活下去。我还没有看到未来的日子，还有很多事情我想做。所以，你不能离开哇！（ σ???)σ	3
食物，这会在工作中，好吧，但我觉得我仍然想离开，离开这里，离开这个世界。做重复的工作，薪水很低，实际上，无情地笑。在里面，没有表情。。。然而，我还得活着，我还没有看到未来的日子，还有很多事情我想做。所以，你不能离开！（）σ？？？）σ	3
晚餐会在课堂上，但我们想离开这里，离开这个世界。做重复性的工作，拿微薄的薪水，实际上，笑得无穷无尽。内里，没有表情。。。我仍然会活下去，哇，我还没有看到未来的日子，还有很多事情要做。所以我不能离开哇！（σ？？）σ	3
晚餐，这将是工作，好吧，但我觉得我仍然想离开，离开这里，离开世界。重复工作，薪水适中，事实上，没有心肺微笑吗？在里面，没有表达。然而，我仍然想获得巨大的成功，我还没有见过，你想做很多事情。因此，你不能留下辉煌的成功！（a）?？俄罗斯	3
吃饭，这是在工作，嗯，但还是想离开，离开这里，离开这个世界。做着重复的工作，拿着微薄的工资，现实中，没有一颗微笑的心。内，无表情。。。但是，我会活下去的。我还没有看到以后的日子。我有很多想做的事情。所以，我不能离开！在σ???)σ	3
为什么我要如此痛苦和不公平？虽然这个世界上没有不公平，但我不愿意离开。在离开之前，我必须带上所有人	3
为什么我要如此痛苦和不公平，虽然这个世界上没有不公正，但我不愿意，在我离开之前，我必须和所有人一起走。	3
无论如何，我会很痛苦，不公正，虽然这个世界上没有不公正，但我不会放弃，在我离开之前，我会带着所有人。	3
为什么它应该如此痛苦、不公平，即使世界并不不公正，我不想去，在我去之前，你必须把所有人团结在一起	3
为什么，我这么痛苦，不公平，对这个世界没有不公平，但是我很后悔，在走之前，我会带着所有的人一起走	3
我也很难过，很高兴来到这里看到那些同情我的人，但我的想法与你的不同。死亡对我来说是一个幸运的选择，让我面对不该忍受的起伏。如果它不够大，我会死的。在我做出决定之前，我会假装乐观，走自己的路。虽然出生在这个世界和这个时代不是你的选择，但既然我出生了，与其说我们应该尊重他们，不如尊重我的父母和家人。强调生活本身	3
我也喜欢来这里看看有同样感觉的人，但我的死和你们的不一样。面对我不应该忍受的颠簸和磨难，这对我来说是一个幸运的选择。我会死，直到我做出决定。我会假装乐观，结束我的旅程。虽然出生在这个世界上的这个时候不是你的选择，但自从我们出生以来，与其说尊重我的父母和家人，不如说尊重我们自己。沉重的生活本身	3
我也喜欢来这里看好人，但我和你的想法不一样，死亡对我来说是一个幸运的选择，可以面对我不应该忍受的颠簸和磨难，我会死，直到我做出决定的那一天，我会乐观地走我的路，即使出生在这个世界的这个时候不是你的选择，但出生后，我们最好尊重父母的家庭。沉重的生命本身	3
我也很喜欢来这里看看有相同感受的人，但我和你对死亡的想法对我来说是不同的，这对我来说是一个幸运的选择，我不应该经历挫折和痛苦，直到我决定的那一天，我才死了。我会假装在通往尽头的道路上保持乐观，虽然我出生在这个时代不是你的选择，但自从我出生在父母和家庭的尊重之外，你就必须尊重生命本身。	3
我也喜欢看服丧来到这里感受到的人们，但我和你们想法不同的死亡对我来说是幸运的选择。我不能面对无法忍受的坎坷和苦难。我会死的。直到我做出决定的那一天我都会假装乐观走自己的路。出生在这个世界上并不是你的选择，但既然出生了，与其尊重父母的家庭，我们更应该尊敬沉重的生命本身	3
每天，我都在耳边听着“想死”这几个字。我真的不能再忍受了。知道一个在无病呻吟，另一个真的想死，但这只是难以忍受的烦恼，想离开，想死。但在现实中，一切都是如此完美，以至于我不能死，不敢死。我害怕让那些重视我的人感到悲伤和沮丧。我不能自私地把黑头发的人送人，但我真的忍不住认为活着是一个错误，没有意义	3
每天我都听到这个词想死在我的耳朵里。我真的受不了了。知道一个人在没有疾病的情况下呻吟，另一个人真的想死。。。但这是一个我无法避免的问题，我忍不住想离开，我想死。但现实是，一切都是如此美丽，以至于我不能死，我不敢死。我害怕让那些重视我的人悲伤，我不能自私，白发人把黑发人送走，但我真的不能忍受觉得活着是一个错误，不活着。	3
每天听两个词来死去。我也真的活不下去了。明知道一个没有呻吟，另一个真的想死。。。但不停下来，想离开，死是值得的。但现实是如此美丽，我不能死，我不敢死。害怕让欣赏我的人悲伤，我不能自私地送白发黑发女郎，但我真的不能生活在认为这是生活的错误中。	3
每天在耳朵里听一个你想死的词。我负担不起。显然，有人知道没有人抱怨这种疾病，一个人真的想死。但你帮不了忙，但你帮不了忙，但你想离开，你想死。但事实是，一切都很幸福，所以我不能死，不敢死。我担心那些关心我的人很伤心，我不能自私白发和黑发，但真的无法忍受活着是一个毫无意义的错误	3
每天都在耳边听着想死这句话。我真的受不了了。一个人无病呻吟，一个人知道真的想死…但是是忍不住的烦，忍不住想离开，想死。但现实是一切都那么圆满，不能让我死，不敢死。害怕让珍惜我的人伤心，我不会给自私的白发人送黑发人，但真的受不了，我觉得自己活着是因为错误而没有活着的意义	3
我厌倦了这个世界，但我没有勇气离开它。我不能放开父母，我不能放开妹妹和弟弟。我不想每天都出去和房间外的人互动。我该怎么办	3
我厌倦了这个世界，但我没有勇气离开这个世界，我不能让我的父母走，我不能让我的兄弟姐妹走，我不想每天都在这个房间里，我不想联系外面的人，我该怎么办？	3
我厌倦了这个世界，但我没有勇气离开它，我不能离开我的父母、我的妹妹和弟弟，我不想每天都在这个房间里，我不想碰外面的人，我该怎么办？	3
我厌倦了这个世界，但他们没有勇气离开这个世界，我不能把父亲放在身边，不能把兄弟姐妹放在身边，我不想每天都在这个房间里，不想碰外面的人，我该怎么办	3
我厌倦了这个世界，但是不敢离开这个世界，我放不下父母放不下妹妹弟弟，我不想每天在这个房间里接触外面的人，我该怎么办	3
有一天，我上吊自杀，其他人以为我在荡秋千。	3
有一天，我挂断了电话，其他人认为我在荡秋千。	3
有一天，我上吊自杀，其他人认为我在摇摆。	3
有一天，我被绞刑，其他人认为我在摇摆。	3
有一天，我被认为是在荡秋千。	3
要是我能在你面前跳楼就好了。那样的话，你可能还记得我。奶瓶也有三个月大了。我希望能花足够的时间和她一起长大，坚持到我不再想死。白天让我快乐的一切在晚上都会恢复原状。	3
能从你面前的一栋楼里跳出来就好了。那你可能还记得我。奶瓶也有三个月的时间，我希望它能和她一起长大，不想死。白天能让我快乐的各种事情在晚上都会回到原来的形式。	3
要是你能跳到你前面就好了。那你可能还记得我。瓶子也有三个月的历史了，我希望它能长得足够长，我不会再死了。任何能让我在白天快乐的东西都会在晚上回到原来的样子。	3
除非你能从前面的大楼跳下来。然后也许你会记住我。婴儿瓶也已经三个月大了，我希望他能和她一起长大足够长的时间，我不想死。白天一切都能让我快乐，晚上再给我打电话。	3
你在你面前跳下去就好了。也许你还记得我。奶瓶也有三个月大，希望和她一起长大的时间能撑到我不想死。白天可以做很多开心的事，到了晚上就会恢复原来的样子。	3
我真的很想结束它。如果我死了，背后会有那么多流言蜚语，我的家人将不得不承受这么多。也许即使我跳楼，尸体也会在我的社交媒体上疯狂传播。我不希望发生这种事。我尽力让自己受伤，保持清醒，即使我受伤了，我也必须坚持更长的时间。这在这个世界上不值得，我不能再伤害他们了。	3
我很想结束，如果我死了，我身后会有多少流言蜚语，我的家人会忍受多少。也许从一栋楼里跳出来，尸体在朋友圈里疯传，我不想要这个。我试图伤害自己，保持清醒，即使我伤害了自己，我也必须再坚持一点，这个世界不值得，我不能伤害他们。	3
我很想结束，如果我死了，我身后会有多少闲聊，我的家人会忍受多少。也许从一层楼跳下来，尸体会在朋友圈里发疯，我不想。我试着伤害自己，保持清醒，即使我受伤了，我也必须再坚持一段时间，人们不值得，我不能伤害他们。	3
我想结束，如果你死了，我背后有多少八卦，我的家人应该忍受多少。我不能说从大楼里跳下来，身体会在朋友圈里发疯，我不想。我试图让自己受伤，保持清醒，即使你伤害了自己，你也必须再次支持，世界不值得，我不能伤害他们。	3
我很想结束。我要是死了，后面还有多少八卦。我的家庭需要承担多少。可能会跳楼，尸体可能会在朋友圈疯传，我不想这样。我尽量让自己痛，清醒，即使伤害了自己，我也要再撑一下，人不值得，我不能伤害他们。	3
我的成年人总是记不起他们对我造成的伤害，无论是语言、精神上的伤害，还是对我的打击。我每天都很难过，很痛苦。前天，我跑到屋顶吹微风，我真的很想跳下去。算了吧，但我担心死后，人们会说我还是个懦夫。如果我走出太空，我就会飞起来。我很困惑，但当我倒下的时候，世界是空的	3
我的长辈们总是不记得他们对我造成的伤害，无论是口头上还是精神上，还是在打我之后，我每天都太悲伤了，前天我跑到屋顶上吹了一阵风，我想跳，但我害怕死后被讨论，如果我还是个懦夫，我会空手而归，我很困惑，我要去这个空荡荡的世界。	3
我的伟人仍然不记得他们对我造成了多大的伤害，无论是口头上的还是精神上的，或者他们每天都让我太伤心，前天昏昏欲睡，在露台上奔跑，在空中呼吸，想跳，但害怕死亡，他们告诉我，我仍然是一个懦夫，我会飞，我迷路了，我会下来，世界是空的。	3
我的成年人不可能总是记得它伤害了我，无论是在语言上还是在精神上，还是在昨天之前的每一天都打我，我都很伤心，跑到屋顶上，我想跳下去，但害怕讨论后死亡，毕竟我仍然是个懦弱的人，我是一步，我会飞，我很困惑，我在空虚的世界下	3
