comment	myLabel
最近，由于自杀可能是一种幻觉，尤其是阅读“量子自杀”一词，我觉得自己可能真的不会死？父亲去世三个月后，我第一次尝试自杀，然后下定决心要死，我选择在茂密的森林里，吊索是一种更紧密的斗争，我朝着石头迈出了一步，很难推动，人们开始空气，绳子开始收紧斗争约十秒钟，然后感觉	9
最近可能会因为自杀而产生幻觉，尤其是看到量子自杀这个词，你真的感觉到自己可能不会死吗。我父亲死后三个月我第一次尝试自杀。我当时抱着必死的决心。我是在茂密的森林中挑选的。悬挂的绳子被打的是活扣子，越挣扎越紧。我一脚踩在石头上，用力踢，人浮在空中，绳子开始被勒紧，是不是开始挣扎了十几秒钟。	9
啊，我昨晚想在窗台上跳楼。从3点到6点半，气温很高。事实上，我很害怕独自一人，但我觉得我的腿都很虚弱。在从上面下来之前，我还是不敢跳下去看天亮。我不想被人看见	9
啊，昨晚我想跳的东西在窗台上从三点到六点半那么高。事实上，我仍然非常害怕孤独。我觉得我的腿很软。黎明时分，我仍然不敢从上面跳下来。我不想被看到。	9
啊，昨晚我想跳到窗台上三到六个半小时的高度啊，我仍然害怕孤独，我的腿柔软，我仍然害怕在白天跳，我从上面下来，我不想被人看到。	9
我想昨晚从3跳到6:30跳下窗户，哦，我真的很害怕有人觉得腿柔软，我仍然不敢从上面跳到你不想看到的黎明	9
啊我昨晚想跳下的窗台从3点到6点半很贵啊我一个人其实很害怕的是自己一个人的脚好像变软了我还是不想看到黎明从上面下来看呢	9
今天我仍然感到很痛。我昨天差点跳下去。如果没有保护屏障，那会更好	9
今天还是很疼，昨天我差点跳了起来，如果没有防护栏，那就好了。	9
今天仍然感觉很好的疼痛，昨天更糟糕的是，如果不是保护屏障	9
今天他仍然感到疼痛，昨天几乎跳了起来，如果没有障碍的话	9
我今天还感觉到痛，昨天差点跳下去，要是没有防护栏就好了	9
我只是打了个盹，然后割破了手腕	9
我也刚上了GG，割伤了手腕。	9
我也来自GG，我割了手腕	9
我刚得到了一个JJ，然后切断了手腕。	9
我也是刚GG割腕的	9
今天我仍然头疼，头晕，身体很疼。听了一整天的经文，只听到外面电闪雷鸣的声音。当我打开窗户时，我有跳进去的冲动。为什么我们需要在窗户上安装防护栏杆	9
今天仍然有头痛，头晕，身体疼痛，在听了一天的经文后，就在闪电和雷声之外，当窗户打开时，有一种跳跃的冲动，为什么窗户要安装防护围栏？	9
今天仍然头痛，晕倒，身体也在受苦，听一天的经文，只是在外面闪烁，打开窗户时想跳，为什么窗户有保护屏障	9
今天你仍然头痛，头晕，身体也很痛，从今天开始听圣经，只是在雷鸣声之外，当冲动向下时打开窗户，为什么要安装防护窗	9
今天也头痛，头晕，身体也痛，听了一天的经文，刚才外面闪电响，打开窗户时有跳楼的冲动，窗户为什么要安装防护栏	9
服用安眠药自杀也很不舒服。我以前试过	9
服用安眠药自杀也很不舒服，我试过了。	9
用安眠药自杀很难，所以我试过了	9
服用安眠药自杀也让人感到不舒服。	9
吃了安眠药自杀也很痛苦的我试着做了	9
昨晚我没能割腕，所以今天下午我跳楼了	9
昨晚他没有割腕，今天下午从大楼里跳了出来。	9
昨晚割腕失败了，今天下午跳	9
昨晚我没有切断手腕，今天下午我跳了起来。	9
昨晚断臂失败，今天下午跳了下来	9
虽然我真的很想死，但我仍然想活着。我每天都在生与死之间徘徊，但我知道死亡赢得了一半以上。唯一能救我的是我的丈夫，但我不知道如何夺走他的心。太痛苦了。孩子一周大了，我什么时候死，这样兄弟姐妹就不会难过了？我再也坚持不住了。我想试着割腕，	9
很明显，我想死，但我想活下去。每天我都在犹豫生与死，但我知道死亡赢得了大部分。唯一能救我的是我丈夫，但我不知道如何夺走他的心，太痛苦了，太痛苦了，孩子已经一个星期了，我什么时候会死，他的兄弟姐妹们不会难过吗？我受不了了，我想试着割腕，	9
他想死，但他想活下去。每天在生与死之间犹豫不决，但我知道死亡占一半以上。唯一能救我的是我丈夫，但我不知道如何把他的心撕下来，太痛苦了，太痛苦，孩子一周大了，我什么时候死，他们的姐夫不会悲伤吗？我拿不住，我想试着割我的手腕，	9
我想死，但我想活下去。生死之间的每一天都在犹豫，但我知道死亡赢得了一半以上的胜利。唯一能挽救我生命的是我的丈夫，但我不知道如何让他的心，如此痛苦，如此痛苦，一周一个孩子，当我想死的时候，她不会悲伤？我负担不起，我想试着切断手腕，	9
虽然想死，但也有想活下去的时候。每天都在犹豫活着和死，但我知道，死赢了大半。唯一能救我的是我的丈夫，但我不知道怎样才能收留他的心。太痛苦了，孩子一个星期了。我什么时候死，他们姐弟不难过吗。我受不了了，我想割腕	9
前天，我割了手腕，看着床上血流成河。我想我很快就能去你要去的地方了，所以我充满了喜悦。晕倒后，我醒来躺在手术室里。我知道这一切必须继续下去。食物，当我躺在病床上时，我非常痛苦。	9
食物，前天割腕，看着血流，填满床，想着很快要去的地方，充满了喜悦，醒来后躺在手术室里，我知道这一切都会继续，食物，我躺在床上的痛苦。	9
晚餐，前天割下手腕，看着持续的血液流动，充满床，认为你很快就能去你要去的地方，充满喜悦，醒来躺在手术室后头晕，我知道这一切都会继续，晚餐，躺在病床上，我很痛苦。	9
大米，昨天之前，剪下手腕，看着血液流动，整张床，想去一个充满喜悦的地方，醒来后头晕，躺在手术室里，我知道这一切都会继续，大米躺在病人的床上我非常痛苦。	9
饭，前天割腕，看到直流的血，床都满了，以为马上就可以去你要去的地方了，充满喜悦，晕醒躺在手术室里，我知道，这一切还会继续下去，饭，躺在床上的我很痛苦。	9
我想跳楼，发现四楼以上的窗户都锁上了。立即将我传送到屋顶。我准备好了，给我一秒钟跳下去	9
如果你想跳，你会发现四楼以上的窗户已经关上了，马上把我送到大楼的屋顶，我准备好了，给我一秒钟跳下去。	9
想跳，发现四楼以上的窗户锁上了，立即传送到大楼的顶部，我准备好了，给我一秒钟跳	9
我想从大楼里跳下来，我发现有四扇以上的窗户被锁好了，我立即转移到屋顶上，我准备好了，给我一秒钟你可以跳下	9
想跳下去，发现四层以上的窗户被锁上了，把我瞬间转到楼顶，我准备好了，让我一秒钟就能跳下来	9
一年前我割腕的时候，我应该把它割得越来越深，这样今天或将来就不会有任何东西了	9
当他一年前割伤手腕时，必须把它切得更深一点，这样就不会有今天或以后了。	9
一年前，当我们割伤手腕时，我们割伤得更深一点，这样就没有今天或之后了。	9
一年前，当手腕被切断时，它应该会越来越深，所以今天或未来都不会有。	9
一年前割手腕的时候应该切得更深的今天和今后都没有	9
量子自杀：你永远不会自杀。在这个世界上，你可以自杀，但在另一个世界上，如果你不自杀，你还活着。你该怎么办？你注定不会死。我已经自杀六次了，但我还活着。我快要崩溃了	9
量子自杀明白你永远不能自杀和死亡，这个世界也可以自杀，但在另一个世界里，你不会自杀，你还活着，我该怎么办？你注定要死。我自杀了六次，我还活着，我要崩溃了。	9
量子自杀学习你永远不会死于自杀，这个世界会自杀杀死你，但在另一个世界你不会自杀，你仍然活着，怎么办，你不能死。我自杀了6次，我还活着，我会崩溃	9
自杀的数量是可以理解的，你不能自杀，这个世界会自杀，但在另一个你没有自杀的世界里，你还活着，怎么做，啊，被判处死刑。我死了六次，还活着。	9
理解量子自杀，你永远不会自己杀，这个世界你也会自己杀，但是在另一个世界你没有自杀你还活着，怎么办，命运不会死。我自杀了6次还活着，我会崩溃的	9
我现在很平静，很平静，如果我发现自己站在六楼的边缘，我可以毫不犹豫地跳下去	9
我现在很平静，如果我站在六楼的边缘，我会毫不犹豫地跳下去。	9
我现在很安静，很安静，如果我发现自己在六楼的边缘，我也可以毫不犹豫地跳下去	9
我现在很冷静，如果我发现自己站在六楼的边缘，我可以毫不犹豫地跳下去	9
我现在很平静，如果发现自己站在六楼的尽头，可以毫不犹豫地跳下去	9
如果我当时跳下去，我不会感到如此不舒服吗	9
如果我跳了，我就不会感到如此不舒服吗？	9
如果我跳了，我就不必这么难了？	9
如果我跳下去，我不想太难。	9
我跳下去的话，我就不用那么难受了，不是吗。	9
我真的很想明天上班时从公司的8楼跳下来。。。。。他们离开后。。。。。。但我担心他们可能会有阴影[不满]	9
如果你明天想去上班，你会从公司的八楼跳下去。。。。。。当他们离开时。。。。。。但我担心他们会有阴影[不满]	9
我想明天从公司8楼跳下来上班。。。。。等他们离开。。。但害怕他们有阴影。	9
我明天想从跳楼公司的八楼去上班。当他们去的时候。。。但我担心这是阴影。	9
我明天想上班从公司八楼跳下来。。。。。他们走了之后。。。。。。。。。但是，害怕他们有影子[懊悔]	9
如果不是因为那道防护栅栏，我昨天在雷雨天气跳到了她的前面。她会在内疚中度过一生吗	9
如果没有那个保护性的围栏，昨天我因雷暴在她面前跳了起来，她会一生都在内疚中度过吗？	9
如果没有这个保护屏障，我昨天在暴风雨中跳到了她面前，她不是一辈子都有罪吗？	9
如果没有障碍，她昨天在一场雷雨中跳到眼前，她一生都将生活在内疚中。	9
如果没有那个防护栏，我昨天借着雷雨天气在她面前跳下去，她会不会一辈子活在内疚中。	9
我太羡慕你了。你只需一次自杀就可以离开这个世界，但我已经自杀了两次，并获救了。现在有这么多网红，我在考虑下次自杀时要不要发微博。。	9
我真羡慕你，一次自杀可以离开这个世界，而我，两次自杀，被救出了。[卖家][卖家][卖家][卖家]现在互联网上有这么多人，我正在考虑下次自杀时不要发微博。。	9
我嫉妒你，自杀一次可以离开这个世界，而我，自杀两次，已经复活了。现在网上有这么多喷气式飞机，我想下次我自杀时，我不会写微博。	9
我真的很羡慕你自杀一次可以离开世界，我自杀两次，他们获救了。[布斯布斯布斯布斯]现在网络上有很多，我想下次自杀不应该太小。	9
羡慕你，自杀一次就能离开这个世界，我，自杀两次，都得救了。[摊位][摊位][摊位]现在网络喷雾剂这《啵我在考虑下一次自杀不要发微博。打开	9
我自杀了五次，注射了胰岛素，烧了木炭，然后得救了。我只是害怕自己会不负责任地死去，给别人带来麻烦。有没有疼痛并不重要，我只想干干净净地死去。	9
他自杀了五次，注射了胰岛素，烧了煤，所有人都获救了。现在我只担心我不负责任的死会给别人带来麻烦，不管有没有痛苦，我只想干净地死去。	9
五起自杀，胰岛素注射，木炭，都得救了。现在我只是害怕不负责任地死去，这会给别人带来问题，没有痛苦，只是想干净一点死去。	9
自杀、注射胰岛素、烧煤的5次节省了费用。现在我只是害怕不负责任的死亡，它会给别人带来麻烦，不管是否有痛苦，我只想死一点干净。	9
自杀5次，注射胰岛素，烧炭，全部获救。现在只是害怕我不负责任的死，会给别人添麻烦，有没有痛苦无所谓，只想死的好看一点。	9
