comment	myLabel
我想你现在的状态应该和几个月前的我差不多。那时，我也觉得生活已经没有希望了。所有的负面情绪交织在一起，写下了遗书，但一切都结束了。我不知道是因为家庭原因还是什么。不管怎样，当你度过这段时间后，你会发现生活是非常美好的	3
我认为你现在的状态应该和几个月前的我相似。当时，我也觉得生活没有希望。所有的负面情绪都交织在一起，遗书都写了下来。但他在这里。我不知道你是出于家庭原因还是什么。无论如何，在经历了这一切之后，你会发现生活非常美丽。	3
我认为你应该和几个月前一样，我也觉得生活没有希望，所有的负面情绪都联系在一起，自杀信都写了，但一切都发生了，我不知道你是出于家庭原因还是什么，简言之，在度过这段时间后，你会发现生活是美好的。	3
我认为几个月前你应该和我在一起的现状并不坏，我还认为当时的生活没有希望，所有的负面情绪都交织在一起，我写了这封信，但它已经到来了，我不知道你是否有原因。无论是家庭还是什么，无论如何，你都可以在这段时间后生存下来，你会发现生活非常美好	3
我觉得你现在的状态和我几个月前差不多。我当时也觉得人生没有希望，所有的负面情绪交织在一起，遗书都写了，但是都来了，我也不知道你是家庭的原因还是什么。总之你要把这一段拉直，才能发现人生是美好的	3
夏天对我这个患有甲状腺机能亢进症的女孩真的很不友好。如果夏天死了，我会选择死	3
夏天对我来说真的很不友好，一个甲状腺功能亢进的女孩。夏天和死亡我会选择死亡。	3
夏天对我来说，这个甲状腺机能亢进的女孩真的很不愉快，夏天和死亡我会选择死	3
夏天对我来说，这个非常不友好的女孩夏天会选择死	3
夏天对甲状腺机能亢进症的我的女孩子真的很不友好夏天和死我能选择死	3
这顿饭我真的很难过。我不知道我能坚持多久。如果不是我的父母，我可能早就离开了这个世界。这些天，一切都在向我袭来，我不知道压垮骆驼的最后一根稻草在哪里。我只希望在它压垮我之前，能发生一些事情，让我觉得生活很有意义	3
食物真的很悲伤，我不知道如果不是因为我的父母，它会持续多久，我可以很久以前离开这个世界，这几天一切都毁了我，我不知道压碎骆驼的最后一根稻草在哪里，我只要求在压碎我之前出现一些让我觉得生活有意义的东西，对吧？	3
我真的很难过，我不知道这会持续多久，不是因为爸爸妈妈，我可能很久以前就离开了这个世界，一切都让我震惊，我不知道最后一根压碎骆驼的稻草在哪里，我只是问，在它压碎我之前，有什么能让我觉得生活有意义。	3
我真的很抱歉，我不知道能持续多久，但因为我的父母很久以前就离开了这个世界，这些天一切都打到了我身上，我不知道最后一根碎骆驼的稻草在哪里，我只是想在粉碎让我感觉到的东西之前出现生活是有意义的。	3
饭我真的好伤心啊。我不知道我还能撑多久。不是为了爸爸妈妈。我可能早就离开这个世界了。这一天所有的一切都冲着我撞了过来。我也不知道压死骆驼的最后一根稻草在哪里。我要它能让我在压死之前觉得活我是有意义的。	3
我觉得我在做噩梦。。。我隐约听到妈妈在叫我，我忍不住哭了起来，因为我全身都凉了。我醒来时丝毫不担心自己快要死了。从那以后，我一直在想，如果生活真的不能继续下去，那就用这种方法自杀吧。	3
就像我在做噩梦。。。我模模糊糊地听到妈妈在打电话给我。由于全身寒冷，他忍不住哭了。当我醒来时，我不怕差点死。从那以后，我一直在想，如果生活真的不能持续下去，就这样自杀。	3
我觉得我在做噩梦。。。模糊地听到我妈妈在叫我。因为他很冷，他忍不住哭了。醒醒，但不要害怕死亡。从那以后，我一直在想，如果生命不能生存，我会用这种方法自杀。	3
在我看来，这似乎是一场噩梦。我听到母亲神秘地呼唤我。因为全身都很冷，这无助于哭泣。我醒来时没有死亡的恐惧。从那时起，人们一直认为生命无法持续，然后使用这种自杀方法。	3
就像做噩梦一样。。。我隐隐听到妈妈在叫我。因为感到冷，不由得哭了起来。我醒了也对快死一点都不害怕。从那以后，我就在想。如果生活真的过不下去，就用这个方法自杀吧。	3
我曾经认为，当我来到学校时，我会觉得自己快要死了，每天都笑不出来。但当我到达时，我意识到它并没有我想象的那么痛苦。我以为其他班，不管我认识不认识，都会批评我。最后，我想得太多了。今天，当我走在上学的路上时，其他同学用真诚而快乐的笑容迎接我。我曾经想过自杀和辍学，但由于各种原因我坚持了下来。今后，我将直面问题，毫不回避地加以解决。	3
有一次，我以为我上学后会像死了一样活着，但当我到达时，我发现这并不像我想象的那么痛苦，我想其他班级，无论我是否认识他，最终都会指着我，骂我。今天我走在学校的路上，当时其他班的人以真诚而快乐的微笑向我致意。我曾经想过自杀和辍学，但在坚持了几个原因之后，我将面对这个问题，并在不逃跑的情况下解决它。	3
我曾经认为我每天都会在学校里生活和死亡而不笑，但当我到达那里时，我发现这并不像我想象的那么痛苦，我想无论我知道与否，课堂都会责备我。今天，我走在上学的路上，学生们欢迎我时的笑声真的很开心。一旦我考虑过自杀，但出于各种原因坚持自杀，我以后会正面解决问题，而不是逃跑。	3
我想死后我会来上学，不要每天都笑，但在我发现它并不像我想象的那么痛苦之后，我认为其他课程，无论你知道与不知道，最终我都会有很多。思考。今天，我走在上学的路上，另一类人在我笑得很开心的时候对我说声招呼。我曾想过自杀，但出于各种原因，我坚持以后会遇到问题，这是不可避免的。	3
我以为我来学校以后生不如死每天都不笑，来了一看并没有我想象的那⊥纯唷Ｎ乙晕不管我知不知道，班上都会骂我，但最后我想了很多。今天我走在学校的路上，其他班的人跟我打招呼。我当时笑出来真的很开心。我曾考虑过自杀退学，但由于各种原因一直坚持下来。我以后会面对问题解决的。那个没有逃跑。	3
我想从10楼跳下来，为自己结束一切，但我很胆小，不敢。在窗台上躺在床上哭了一下午后，我暗暗决定再也做不下去了，开始与生活作斗争。现在，今年，我即将进入大学，我感觉自己越来越好了。一切都会好起来的，我希望你也能变得更好。	3
他想从十楼跳下去，把他所有的东西都吃完，但害羞，不敢，他从窗台上下来，躺在床上哭了一下午，秘密地决定不可能是这样，所以他开始与生活作斗争，现在，今年，我马上要进大学了，我觉得我已经很好了，一切都会好起来的，我希望你们也能好起来。	3
我想从10楼跳下来，为自己完成一切，但是，害羞，我不敢，我从窗台上下来，下午哭着躺在床上，我决定我没有，我开始为生命而战，现在，今年，我很快就要上大学了，我觉得我会好起来的，一切都会好起来，我希望你也会好起来。	3
我想从10楼跳到一切结束，但是，害羞，不敢，从窗户到躺在床上，今天下午哭泣，我秘密决定你不能开始与生活作斗争，现在，今年，我即将进入在大学里，我感觉很好，一切都会好起来的，我希望你能变得更好。	3
从10楼跳下来想结束自己的一切，但是胆小，不敢，从窗户下来趴在床上哭了一晚上，暗地里决定它做不到，开始了生活和斗争，现在，今年，我就要上大学了，我觉得自己早就好了一切都会好的，希望，你们也会好的。	3
跳下去是一件简单的事情，但如果你被家庭、友谊、爱情以及所有与你有关的外界事物所牵引，你甚至无法爬上屋顶	3
跳跃是一件简单的事情，但如果它被家庭、友谊、爱和外界所有与自己有关的东西所拖累，它甚至无法爬上屋顶。	3
跳跃是一件简单的事情，但如果他被深情友好的爱和一切外在的东西所吸引，他就不可能登上领奖台。	3
跳下去很简单，但如果被家庭、友谊、爱情和所有与外部世界有关的事情所吸引，它就无法浮出水面。	3
跳楼是一件很简单的事情，但是如果被亲爱的友谊爱情和外界所有与自己有关的东西所牵引，跳楼的能力也就没有了	3
痛苦，我对这个世界几乎绝望了。活着就像行尸走肉一样毫无意义。当我积累了足够的失望和勇气去死的时候，我会追随你的脚步！	3
痛苦，几乎对这个世界绝望，活着和感受行走的尸体是没有意义的，当我积累足够的失望和勇气去死的时候，我会追随你的脚步！	3
痛苦，几乎已经绝望的世界，活着的感觉就像走死了没有意义，当我积累了足够的失望和勇气去死，我会跟随你的脚步！	3
痛苦，在这个世界上几乎没有太多绝望，活着感觉死了走路毫无意义，所以你救了足够的失望和勇气去死，你会追随你的脚步！	3
痛苦，差别不多已经对这个世界绝望，活着的感觉活着的尸体没有意义，我积蓄着失望和走向死亡的勇气，我追随你的步伐！	3
我所谓的“朋友”都离我很远，现在我一个人，每天过着平静而淡泊的生活。我担心如果我真的自杀了，我的父母会担心我。他们非常爱我，我也非常爱他们。然而，我现在感到的内疚远远超过了他们对我的爱。当我以前没有自杀的想法时，父母的爱支持了我，阻止了我去想。	3
所谓的“朋友”已经离开了我，现在我独自一人，每天过着简单的生活。我担心如果我真的自杀了，我的父母会担心我，他们非常爱我，非常爱他们，但现在我比他们更为自己感到内疚。当我不想自杀时，我父母的爱在那一刻支持了我，所以我没有。	3
所谓的“朋友”离我很远，我现在独自一人，过着平淡的一天。我担心我的父母会担心我，他们爱我，我非常爱他们，但我现在内心的内疚感远远大于他们对我的爱。一旦我还没有自杀的想法，我父母的爱支持我，让我没有这个想法。	3
所谓的“朋友”现在离开了我，我一个人，每天都有光过去。我担心我父亲会担心我，他们爱我，我爱他们，但现在我比他们爱我更内疚。我不想考虑自杀，然后父母的爱支持我，所以我不会有这样的想法。	3
所谓的“朋友”们都离我远去，我现在是一个人，每天平静地生活着。我害怕我真的自杀了，我的父母担心我，他们爱我，我也爱他们，但是我现在身体的内疚已经远远超过了他们对我的爱。当我还没有想到自杀的时候，那时父母的爱支撑着我，让我没有那个想法。	3
我真的不想再笑了。我想大喊，想哭，想告诉全世界我累了。我真的坚持不下去了。但是，当一个人长期乐观时，即使她在上吊，其他人也会认为她在摇摆	3
我真的不想再笑了，我想大喊大叫，大声告诉世界我累了，我真的忍不住了，但当一个人乐观了很长一段时间，即使他被绞死了，别人也会认为他在摇摆。	3
我不想再笑了，我想尖叫和哭泣，告诉世界我累了，我真的无法忍受，但当有人乐观时，即使她上吊自杀，也有人认为她在摇摆。	3
我真的不想再笑了，我想尖叫、哭泣，告诉世界我太累了，我真的受不了了，但当这个人长期乐观时，即使她挂在别人身上，她也会认为自己在摇摆不定。	3
我真的不想笑。我想大声哭。全世界都说我累了，我真的受不了，但我希望她能乐观，无论是上吊还是坐在秋千上的人。	3
窒息而死是非常痛苦的。我不敢割腕。事实上，我不敢死。虽然生活并不幸福。	3
窒息死亡是痛苦的。我不敢割腕。事实上，我不敢死。虽然我不高兴活着。	3
窒息而死是痛苦的。割手腕也不敢。事实上，我不敢死。即使生活不快乐。	3
窒息是痛苦的。不敢切断手腕。事实上，他不敢死。尽管生活并不幸福。	3
窒息而死很痛苦。我割腕都割不了。其实我不敢死。虽然活着也不开心。	3
我也想过，如果我走了一次世界，仍然没能实现我的梦想，找不到活下去的理由，找不出能留住我的一小部分，那么我就会自杀	3
我还认为，如果我环游世界一次，我就无法实现我的梦想，找不到活下去的理由，找不到一个能留住我的小部分，我会自杀。	3
我还想，如果我再次接管这个世界，我还不能实现我的梦想，找到生活的理由，保持我的一小部分，我会自杀。	3
我还想到，如果世界再次消失，无法实现梦想，找不到生活的理由，找不到我国家的一小部分，然后自杀	3
我也想过。如果走遍世界一次，还没有实现自己的梦想，找不到活下去的理由，找不到可以留住我的小部分，就自杀了	3
有时我只是想，我必须活下去，我必须活着，无论如何我必须保住我的生命，我太害怕死亡了。我也有我的父母。他们爱我，我不能死，我害怕死。割腕太疼了，而且还是车祸。我在医院住了一个月才活下来。我怎么会死？我必须活着	3
有时我想知道，我必须活着，我必须活着，无论如何，我必须拯救自己的生命，我太害怕死了。我仍然有父母，他们爱我，我不能死，我也害怕死，手腕被割伤太痛了，车祸也发生了，我在医院住了一个月才活下来，我怎么能死，我必须活下去？	3
有时候我觉得我必须活下去，我必须活，我必须保住我的生命，我太害怕死了。我仍然有父母，他们爱我，我不能死，我害怕死亡，割伤的手腕太痛，车祸也一样，我在医院住了一个月才活下来，我怎么能死，我必须活下去	3
有时我在想，我必须活着，我必须活着，生命应该如何生存，我非常害怕死亡。我仍然有我的父亲，他们爱我，我不会死，我害怕死亡，我非常痛苦地割下手腕，发生车祸，我在医院住了一个月才活着，我怎么能死，我必须活	3
我要活下去，我要活下去，怎么我也要留下生命，我怕死。我有父母。他们爱我。我不会死的。我也怕死。割胳膊很疼。车祸也是，我住了一个月的医院才活下来的。我怎么会死呢。我必须活下去	3
白天笑，谁知道下班后摘下口罩时我有多累？有一刻我想离开这里，但现实告诉我这是不可能的，	3
有一天，我在白天微笑，谁知道我下班后摘下口罩有多累，有一段时间我想离开这里，但现实告诉我我不能，	3
有一天白天笑，有人知道我是多么厌倦了卸下工作的面具，有一种瞬间想离开这里的愿望，但现实告诉我不，	3
今天，一天后，他微笑着，他知道我是如何厌倦清空工作面具的，所以我想离开这里，但现实告诉我不，	3
白天笑着度过一天，有人知道下班摘下面具的我有多累，有一瞬间我想离开这里，但现实告诉我不行。	3
我真的很讨厌这个世界。我想离开这个家，为什么命运从来都不公平。我想重新选择我的生活。	3
我真的很讨厌这个世界，我想离开这所房子，为什么命运永远不公平？我想重新选择我的生活。	3
我真的很讨厌这个世界，我想离开这个家，为什么命运永远不公平。我想重塑我的生活。	3
我真的很讨厌这个世界，哦，我想离开这所房子，为什么这不是一个公平的命运。我想再次选择我的生活。	3
我真的很讨厌这个世界。我想离开这个家。为什么命运不公平。我好想再一次选择我的人生啊。	3
嗯，我每天都感到很难过。我每天都在哀悼，第二天继续哀悼。很多时候，我想自杀，但我害怕痛苦，害怕死亡，害怕父母难过。也许是因为我还不够绝望。我不知道我最后是自杀了，是看透了还是看不透	3
好吧，我每天都很难过，葬礼后的每一天都要继续第二天的葬礼，很多时候我想自杀，但我害怕痛苦，害怕死亡，害怕悲伤的父母，也许是因为我不够绝望，我不知道，我最终会自杀，是看到开放，还是看不到开放	3
好吧，每一天都失去了，每一天都结束了，继续哀悼第二天，很多时候想自杀，但害怕痛苦，害怕不死，害怕父母的悲伤，也许，因为我没有足够的绝望，或者不知道，最终自杀，看到或不看到	3
生活就像一盒巧克力，你永远不知道会发生什么。	3
嗯，每天都很服丧，每天服丧后继续第二天的服丧，好几次都想去自杀，但是怕痛，怕死，怕父母伤心，也许，是因为我还没有绝望吧，也不知道，最后自杀的，到底是看了没有还是看不到	3
我被困在这个地方很长时间了，每天都在试图逃离这个世界	3
我每天都想逃离这个世界，我被困在这个地方很长时间了。	3
日复一日，我想逃离这个世界，我被困在这个地方很久了	3
日复一日，我试图逃离这个世界，我被困在这个地方很长时间了。	3
日复一日，我想逃离这个世界，我被困在这个地方很久了	3
抑郁症患者是如此痛苦，以至于他们不敢告诉任何人他们知道自己再也无法忍受了	3
一个不敢告诉任何人自己能忍受的沮丧的人有什么痛苦？	3
抑郁症患者不敢告诉任何认识他们的人一个人再也无法忍受是多么痛苦	3
抑郁症患者不敢告诉任何认识他们负担不起的人如何痛苦	3
抑郁症的人有多痛苦，不能让一个知道的人一个人承受不起。	3
恶心和悲伤，每个人都认为你没有死的理由，每个人认为你应该学会感恩。你从来没有向你认识的任何人提到过你感到悲伤和想死，他们什么都不知道。即使我这么说，我也只会说这是因为我的抗压能力较弱和我自己的弱点。他们都不知道这对我来说有多困难，他们甚至不知道我的内脏已经被损坏和腐烂到没有形状的地步。	3
恶心和悲伤，每个人都认为你没有理由死，每个人都认为你是一个必须学会感激的人，他们从来没有提到过他们认识的人，他们很悲伤，想死，他们什么都不知道。即使他这么说，也只能说他的抗压能力不强，是他自己的巢穴。他们都不知道，这有多难，我也不知道，我的内心破碎而腐烂。	3
厌恶和悲伤，每个人都认为你没有死的理由，每个人觉得你是一个应该学会感恩的人，从来没有向他认识的人提到过他对死亡的悲伤渴望，他什么都不知道。即使这样说，也必须而且只能说，这是他们自己的压力阻力不强，这是他们自己的袋子。他们都不知道，我是多么挣扎，我的内心是多么破碎和腐烂。	3
恶心和悲伤，每个人都认为你有任何理由去死，我认为你应该学会感恩，那些想悲伤死去的人不知道他们什么都不知道。即使他说，我也只能说抗压能力不强，他也是一样的。他们不知道，我不知道这有多困难，我不知道，我内心已经破碎了，看起来没有腐败。	3
恶心难过，每个人都认为你没有理由死，都认为你是一个应该学会感恩的人，从来没有对认识的人说过自己伤心想死的话，他们什么都不知道。说起来，自己的抗压能力不强，应该只能说自己很邋遢。他们都不知道，我有多不安，都不知道，我的内心已经坏了，已经没有腐烂的样子了。	3
为什么我没有勇气跳楼或烧炭，当我想死但害怕死亡时，尽管我自我贬低和救赎	3
如果我腐败和救赎自己，我想死，但我害怕死亡，为什么我没有勇气从一栋楼里跳下来或烧炭？	3
自我堕落和自我救赎死亡和害怕死亡我怎么没有勇气跳或烧煤？	3
我怎么能没有勇气跳下去或烧煤？	3
想自甘堕落救死自己却怕死的我为什么没有那个勇气跳楼烧炭呢。	3
真的被自己的思想和黑暗淹没了，一个人可能会不知不觉地离开。我不会留下遗书，因为我认为我们离开时应该更加无忧无虑。遗书太繁琐了	3
真的被自己的思想和阴影所淹没，上帝可能会不知不觉地离开。我不会留下遗书，因为我认为离开比较容易，遗书太重了。	3
真的被自己的思想和阴影淹没了，上帝可以无意识地离开。我不会保留遗赠，因为我认为你必须走一点，遗赠太重了。	3
如果你真的被你的思想和阴影所淹没，你可能会被忽视。我不会留下信息，因为我认为我应该轻松一点，信息很有压力	3
真的被自己的想法和阴湿所埋没，可能会不知不觉地走下去。我不会留下遗书的。我觉得遗书很麻烦，因为我觉得我应该走路	3
死前带上它们	3
在他们死前把他们带在一起	3
死前和他们一起走	3
在他们死前拿走他们。	3
在死之前带我去	3
没想到，我发现了这条微博。当我把它翻过来时，眼泪顺着我的脸流了下来。我想自杀，割腕，割腕。我不能死，我不能死	3
出乎意料的是，他听到这条微博，转过身来，看到眼泪落了下来，他想自杀，他想割腕，他想割腕，他想割腕，他不能死，他不能死，他不能死。	3
不小心知道这个微博，回头看，看到眼泪落下，想自杀，想割手腕，想割腕，想割腕，想割腕，不死，不死	3
我不想死，我想砍掉手腕，我想砍掉手腕，我想砍掉手腕，我想砍掉手腕，我想砍掉手腕，他不会死，他不会死，他不会死	3
居然知道这条微博，翻来覆去看，泪流满面，想自杀，想割腕，想割腕，割腕，割腕，割腕，不能死，不能死，不能死	3
大米我真希望她能回来。虽然我现在一无所有，但我已经计划好了。昨天我恳求了一整天，但无法实现我的愿望。我不想再找任何理由或动机了，太累了。看着她没心没肺，也许她不会那么伤心。我很害怕去一个没有她的世界，我真的很想见她。Rice，给我勇气。死也没什么大不了的，是吧。痛苦和挣扎太难以忍受了。我们见面时我能拥抱你吗。	3
食物。奇怪的是他能回来。虽然我现在什么都没有，但我已经计划好了。昨天他恳求有一天他不能做他想做的事。我不想找到更多的理由和动力，我太累了。看着他的绝望，也许他没那么难过。我害怕去一个没有它的世界，我很想看到它。范，给我点勇气。死没什么大不了的，是吗？痛苦和斗争太不舒服了。我们见面时我能抱着你吗？	3
晚餐。我希望她回来。虽然我现在什么都没有，但我已经计划好了。昨天我恳求有一天没有成功。不要再寻找理由和动力了，累了。看着她坠入爱河，也许她不会那么伤心。我害怕进入一个没有她的世界，我想见到她。吃饭，给我勇气。死亡并不严重，不。疲倦和挣扎太难了。我们见面时我能抱着你吗？	3
一顿饭。我认为她可能会回来。虽然我现在什么都没有，但我已经计划好了。昨天我乞求了一天。我不想找到原因和动机，太累了。在爱情中看着她可能不会太难过。我害怕没有她去世界，我想见她。大米，给我一些勇气。死亡不是什么大事，是吗？苦难和斗争非常困难。我们见面时我可以带你吗？	3
米饭。我希望她回来。现在的我什么都没有，但是我已经计划好了。昨天一天愿望没有实现。我不想再找理由和动力了，我累了。看着她的无情，她可能就不会那么伤心了。我害怕去没有她的世界，我想见她。饭，请给我勇气。死了不就好了吗。痛苦的灯火很痛苦。我们见面的时候我能拥抱你吗。	3
为了积累离开这个世界的勇气，我们还要经历多少次悲伤？我希望这一天很快到来	3
还要经历多少次悲伤才能节省死亡的勇气？我希望这一天很快到来。	3
为了有勇气离开这个世界，你还需要经历多少次悲伤？希望这一天来得早	3
毕竟，为了挽救足够的离开世界的勇气，你应该多久经历一次悲伤？我希望这一天能早点到来。	3
到底经历了多少次悲伤，才能积蓄离开人世的勇气呢。希望这一天快点到来啊	3
