comment	myLabel
听说安眠药死亡需要一段时间才能出现疼痛，如果剂量足够大，疼痛会很快消失。	7
我听说安眠药会死亡，如果剂量足够大，会有一些疼痛，疼痛会很快。	7
听说安眠药死了，过一段时间就会有痛苦，但如果有足够的剂量，痛苦很快就会过去。	7
跳楼可能是最致命的方式，对吧？从26楼往下看，它真的很高，很吓人。四肢会折断，脑袋会开花。如果它击中了别人怎么办？	7
从一栋楼里跳下来应该是最致命的方式，对吧？从26楼往下看，它真的很高很可怕。四肢会骨折，头部会开花。如果他打别人呢？	7
跳跃应该是最致命的方式，对吧？从26楼下来，很高，很可怕。四肢会断裂，头会开花。如果这会让其他人崩溃呢？	7
跳下大楼应该是最高的死亡率，对吗？从26楼看，很高，很可怕。他的四肢会断开，头部会茁壮成长。如果别人殴打怎么办？	7
跳楼不是死亡率最高的方法吗。从26楼眺望，好高啊，好可怕。四肢折断，头张开。如果撞到人了怎么办？	7
但他们表示，烧炭也会非常痛苦，以确保在烧炭的过程中没有人来，只是害怕有人经过或其他什么，害怕从门缝里发现烟雾	7
但他们说，燃烧煤炭也将是非常痛苦的，以确保在此过程中没有人会来，但他们担心有人会通过或什么，因为他们担心烟雾会从门的裂缝中被发现。	7
但他们说燃烧木炭会很痛苦，确保没有人会进入这个过程，只是害怕有人经过或什么，害怕烟雾从门缝中冒出来。	7
但他们说烧煤可能会很痛苦，确保没有人会参与这个过程，只是担心有人会通过之类的东西，担心会发现烟雾穿过门上的裂缝。	7
但是，他们说烧炭也很痛苦，确保过程中没有人来，只是怕有人通过，怕烟通过门缝出去被发现	7
不，跳楼太暴力太引人注目了。我认为世界上最仪式化的自杀方式是溺水	7
不，从一栋楼里跳下来太暴力了，太引人注目了，我认为世界上最仪式化的自杀方式是溺水。	7
不，跳跃太暴力，太引人注目，我认为世界上最仪式性的自杀方式是溺水。	7
不，从一座非常暴力的建筑物中跳下，我认为世界上最常见的自杀方式是溺水。	7
不，跳楼太暴力了也很受关注。我认为世界上最具仪式性的自杀方式就是溺死	7
当我站在十三楼的边缘往下看的时候，我的心跳很快，我想一边后退一边跳下去	7
当你在13楼的边缘向下看时，你的心跳特别快，而你想跳起来后退。	7
当向下看十三楼的边缘时，心跳特别快的一面想要跳跃和后退。	7
当我站在13楼的边缘向下看时，当我试图向后跳时，我的心跳非常快。	7
站在十三楼的尽头往下看的时候，心跳得很厉害，想跳下去就退到后面了	7
如果我跳到七楼，我会死吗？	7
我要跳到七楼就死了？	7
我会跳到七楼死吗？	7
我会跳到七楼去死吗？	7
我跳七楼是不是就死定了。	7
不幸的是，我找到了上吊自杀的方法。我可能不愿意采取行动，但我可能会继续这样折磨自己。	7
一个悲伤的消息，我找到了一种挂断自己的方法，如果我能把手放下，但我可以继续这样折磨自己。	7
一个悲伤的消息是，我找到了一种绞死自己的方法，我无法把手放下，但我可以继续这样折磨自己。	7
坏消息是，我找到了上吊的方法，我不能下去，但我一直在折磨自己。	7
不幸的消息使我找到了开除自己的方法。我不用把手放下，但我可能会一直折磨自己。	7
我去蹦极是为了准备将来跳楼	7
我要跳蹦极，为将来从大楼里跳下去做准备。	7
我要去蹦极，为以后的跳跃做准备	7
我要跳绳，为以后跳绳做准备。	7
我去蹦极是为了准备跳楼	7
我真的想跳下去结束一切	7
我想跳起来完成一切。	7
想跳下去结束一切	7
我想跳到这一切的尽头。	7
想要跳楼结束	7
燃烧木炭会因为缺氧而引起嗜睡，然后你就可以睡觉了。它会在你的睡眠中逐渐窒息死亡，不会感到任何疼痛。有关更多详细信息，您可以自己在百度上搜索	7
燃烧煤炭会因为缺氧而感到困倦，然后你可以睡觉，逐渐窒息，在睡觉时死去，你不会感到疼痛，特别是你可以自己百度。	7
木炭会因为缺氧而感到困住，然后你会不顾睡眠，在睡眠中逐渐窒息死亡，不要感到疼痛，你可以百分之百地	7
烧煤会因缺氧而感到困倦，然后即使你要睡觉，你也会逐渐死于窒息性睡眠，不要感到疼痛，具体来说，百度可以	7
烧炭会因缺氧而困倦，然后你即使睡着了，也会在睡梦中渐渐窒息而死，不会感到痛苦。具体你可以自己百度一下	7
那些不会死在床上的人会跳下去	7
那些不会死在床上的人会跳起来	7
不会死在床上的人会跳	7
他不会死在床上。	7
不会死在床上的人会跳下去	7
如何挂车门把手	7
门把手怎么挂？	7
如何悬挂门把手？	7
如何举起门把手	7
门把手怎么上吊。	7
我第一次想那样跳下去	7
第一次我想跳这么多	7
我第一次想跳	7
第一次我想跳	7
我第一次那么想跳下去	7
又过了一天。K告诉我，我们一起跳楼好吗？我甚至隐约预料到了我的身体落地、大脑爆裂的那一刻。	7
又过了一天。K告诉我我们是否要一起跳。我甚至模糊地等待着我的身体掉在地上，我的大脑崩溃的那一刻。	7
又一天过去了。K告诉我我们是否要一起跳？我甚至秘密地期待着尸体倒塌和爆炸的那一刻。	7
又过了一天，你告诉我我们会一起跳下大楼吗？我甚至期待着身体坠落和大脑爆炸的时刻。	7
又过了一天。K说我们要不要一起跳下去。我微微地期待着身体掉下来脑浆迸发的瞬间。	7
我太害怕了，不敢用一把又一把刀在胳膊上割腕	7
手臂上有一把刀，另一把刀不敢割伤手腕	7
一次又一次地在手臂上，不敢割伤手腕	7
不要用刀在手臂上切断手腕。	7
胳膊上好几次都不敢割胳膊	7
突然意识到跳楼并不是很没有吸引力	7
突然间，我发现从一栋楼里跳下来死并不是很难看。	7
突然发现死亡跳跃也不难	7
突然，我发现从死亡大厦跳下来并不丑陋。	7
突然跳楼发现死相也不难看	7
没有一天的生活是有趣的。今天中午，我想象着新闻里跳楼的人如果是我也会放手。	7
生活中没有一天是有趣的。今天中午，我在新闻上想象了那个从大楼里跳出来的人，如果是我，他会放他走的。	7
没有一天生活有趣。今天中午，我想象着如果是我，那个跳上新闻的人也会放手。	7
有一天生活没有乐趣。想象一下，今天下午新闻中有一个人从一栋大楼跳下。	7
没有日子过得有趣。今天中午的时候，我在想新闻上跳楼的人如果是我的话会放手的吧。	7
我真的有烧炭的女孩吗	7
我真的有一个烧煤的女孩吗？	7
我是认真的吗，木炭女孩？	7
我有一个燃烧的女孩吗？	7
我真的有烧炭的女儿吗？	7
我想跳楼，我好害怕	7
我想从大楼里跳出来，我很害怕。	7
想跳，害怕。	7
我想跳下大楼，非常害怕	7
想跳下去，好可怕	7
从71楼跳下来是什么感觉	7
从71楼跳下来感觉如何？	7
跳到71楼是什么感觉	7
从71楼跳下怎么办？	7
跳下71楼是什么感觉	7
我想试着烧炭，但似乎不疼	7
试图燃烧煤炭似乎并不痛苦。	7
想尝试燃烧木炭似乎没有伤害	7
试图燃烧煤炭似乎没有坏处。	7
虽然想烧炭，但是好像不痛	7
