comment	myLabel
你试过了吗？我想从大楼里跳下来，我也想上吊，但很难考虑。	7
你试过了吗，我想跳，我想上吊，但很难思考	7
你有没有尝试过从一栋楼跳到另一栋楼，但想起来很难	7
跳下去也想上吊，但一想就受不了	7
跪地乞求一种无痛的自杀方法，跳楼应该是好的，但影响太负面了	7
跪下恳求所有人不要受苦的自杀方法应该对从大楼里跳下来有好处，但影响太糟糕了。	7
每个人跳跃的无痛自杀方法应该是好的，但效果太糟糕了	7
跪下来乞求每个人都没有自杀的痛苦跳下大楼的方法应该很好，但效果很差	7
跪下来给大家寻求一种不痛苦的自杀方法应该是好的，但是影响太差了	7
酒后跳楼好吗	7
喝酒后最好从大楼里跳出来？	7
喝葡萄酒跳不好	7
饮酒后跳下大楼不是更好吗？	7
喝点酒跳下去不是更好吗。	7
晚饭时，我昨晚没割腕。啊，太不舒服了。我想死，切错地方。真的很疼。顺便问一下，是否有人预约一起烧炭=“http://t.cn/RgmkxWr“Suda uatrack=”key=transit_Pic&value=transit_Pic_Minicard“=”JavaScript:void（0）；“；”操作类型=“小部件_照片视图”操作数据=“对象_Id=1022:230597a17d4901641957ee484c8b4b3f4b215&pid=a0de4a3dgy1ftig32zf7tj20qo0zk78y&mid=324488317640210&cid=42645334334354953032&short_ URL=http://t.cn/RgmkxWr“Imagecard=”pid=a0de4a3dgy1tig32zf7tj20qo0zk78y“><i class=”W_ FICON FICON_ CD_ Img WBficon“>？</i>评论标题</a>	7
在晚宴上，我昨晚没能割腕。不幸的是，想要死是如此的不舒服，不能在正确的地方被割伤，这真的很痛苦。顺便问一下，是否有一起燃烧煤炭的约会http://t.cn/RgmkxWr“suda-uatrack=”key=transit-pic&value=transmit-pic-minicard“href=”javascript:void（0）；“action-type=“widget photoview”action-data=“object id=1022:230597a 17d 4901641957ee484c8b4b3f4b2215&id=a0de4a 3dgy1ftig32zf7tj20qozk78y&mid=3424883176420&cid=4264534354953032&short urlhttp://t.cn/RgmkxWr“imagecard=”id=“a0de4a3dgy1ftig32zf7tj20qo0zk78y”><i class=“w小说cd img wbficon”img wbficon？？//I>评论地图<A>	7
吃饭时，我昨晚没能割手腕。唉，死在错误的地方很难，真的很痛苦。顺便说一句，是否有煤一起燃烧<a alt=“http://t.cn/RgmkxWr“suda uatrack=”key=transmit pic&value=transmit pic minicard“href=”javascript:void（0）；“action type=“widget photoview”action data=“object id=1022:230597a17d4901641957ee484c8b4b3f4b2215&pid=a0de4a3dgy1ftig32zf7tj20qo0zk78y&mid=3424883176420210&cid=4264534354953032&short url=http://t.cn/RgmkxWr“imagecard=”pid=a0de4a3dgy1ftig32zf7tj20qo0zk78y“><i class=”w ficon ficon cd img wbficon>？</一>评论和插图</a>	7
晚餐时，我昨晚没有剪下手腕。没有男人或女人值得你流泪，也没有人会让你哭泣。另一方面，您是否与煤炭有预约？>替代品”http://t.cn/RgmkxWr“suda-uatrack=”键=图像转码，值=转码JavaScript图像：空白（0）；“工作类型=图像片段”数据工作=U ID对象=1022:230597a17d490164957ee484c4b3f4b2215和PID=a0de4a3dgy1ftig32zf7tj20qo0zk78y和Med=34248317642010和主=4264534435495032和短u链接http://t.cn/RgmkxWr“Imagecard”=“ID=a0de4a3dgy1ftig32zf7tj20qo0zk78y”>I class=”和“WBficon”？”I>评论	7
饭，我昨晚割腕失败了。哦，痛苦的想死也切不到地方，真的好痛。顺便说一下，我们约好一起烧炭http://t.cn/RgmkxWr“suda-uatrack=”key=transmit_pic&value=transmit_pic_minicard“href=”javascript:void（0）；“action-type=”widget_photoview“action-data=”object_id=1022:230597a17d4901641957 ee484c8b4b3f4b2215&pid=a0de4a3dgy1ftig32zf7tj20qo0zk78y&mid=3424883176210&cid=4264534354953032&short_url=http://t.cn/RgmkxWr“imagecard=”pid=a0de4a3dgy1ftig32zf7tj20qo0zk78y“><i class=”W_ficon_cd_评论地图	7
高中上课的时候，我突然听到一声巨响，想去看看，但被老师拦住了。后来才知道，学生们从5楼跳了下来，脑子都出来了，但幸运的是，当时他们没有看。当时，我不理解这个学生的行为，一直认为活着总比死好。但现在，痛苦越来越深，我觉得死亡是一种解脱，但我不会选择跳楼。我在游乐园玩过跳楼之类的游戏，我觉得有点害怕。那样死是不好的，最好把自己扔进一个更安静的湖里	7
早些时候，当我在高中上课时，我突然听到一声巨响，我想看看，老师阻止了他。后来，我发现学生们从五楼跳了下来，他们的大脑已经出来了，但幸运的是，他们当时没有看到。当时，当他不理解学生的行为时，他总是认为死总比活着好。但现在，痛苦越来越深，我觉得死亡是一种解脱，但我不会选择从一栋楼跳下去，我玩过一些游戏，比如带着一点恐惧从游乐园的一栋楼跳下去，所以死是不好的，最好扔一个更安静的湖。	7
以前，在高中，在课堂上，突然听到一声巨响，想看看，老师停了下来。后来得知，学生们从5楼跳下来，没有看。由于不理解学生的动作，他总是认为死总比活好。但现在疼痛越来越深，感觉死亡是一种解脱，但我不会选择跳跃，在游乐园玩跳跃等游戏有点害怕，这样死去不是很好，也不比扔湖水更平静	7
高中毕业前，突然我听到一声巨响想看，老师停了下来。后来我得知学生们从大脑的五楼跳下，幸运的是，我当时没有见过。我不理解学生当时的行为，我总是认为死去比活着更好。但现在，痛苦越来越深，我觉得死亡是一种解脱，但我不会选择跳下大楼，在类似的游戏场上，有点害怕地跳下大楼，即使死亡也不是很好，因为它会抛下一个相对平静的湖	7
以前高中的时候上课，突然听到很大的声音想去看，老师阻止了。后来发现学生从五楼跳下来脑浆冒了出来，幸好没看到。当时我不理解那个学生的行为，觉得他死了比较好。但是现在，痛苦越来越深，认为死亡是一种解脱，但我不能选择跳楼。我在游乐园玩过跳楼之类的游戏。那样死是不好的。扔到湖里比较安静	7
烧炭不觉得那么痛苦，但我也害怕窒息。。	7
烧煤不会那么痛苦，但他害怕窒息。。	7
烧木炭不会那么痛苦，但害怕窒息。	7
烧煤不会感到疼痛，而是害怕窒息。	7
烧炭没那⊥纯啵但我害怕有窒息感。打开	7
北京有女孩想烧炭吗	7
北京有想烧煤的女孩吗？	7
北京的一个女孩想烧木炭？	7
北京有想烧煤的女孩吗？	7
你有女儿想在北京烧炭吗。	7
上吊跳楼自杀成功率最高的自杀方法是一种如果选择这样做就不会后悔的方法	7
挂断和跳下大楼自杀最成功的方法是，无论如何，如果你选择它，你就不能后悔[思考]	7
最成功的自杀方式是跳跃上吊自杀，无论如何都不能通过选择这样做来忏悔[思考]	7
绞刑自杀的最高成功率无论如何，选择这样做不会后悔[思考]	7
上吊跳楼成功率最高的自杀方法反正选择做就不会后悔[思考]	7
谁烧炭	7
谁烧煤？	7
谁烧煤	7
燃烧煤炭	7
谁烧炭	7
这次我要割腕。等我	7
这一次我要割腕等着。	7
这一次，我要割下手腕等待。	7
这次我要砍掉手腕。	7
饭下次要割腕等着哦	7
我想跳楼，它真的很快，准确，无情	7
我认为从一栋楼里跳下来真的很快，很准确，很无情。	7
我真的很想跳得快	7
我认为很难跳出大楼。	7
我觉得跳下去真的很快。	7
那就烧炭吧，不	7
然后烧煤不	7
然后木炭不会	7
然后燃煤不	7
然后烧炭	7
就自杀方式而言，我认为跳楼是目前最快的逃生方式，因为它会导致肝脏损伤和窒息。	7
在自杀的方式上，我认为从一栋楼里跳出来是目前最快的解脱，肝脏破裂，死亡突然窒息。	7
就我自杀的方式而言，我认为跳楼梯是最快的解脱，突然，肝脏破裂，死亡窒息。	7
我认为自杀是离开大楼的最快方式，突然肝脏骨折、死亡和窒息。	7
我想自杀方法，现在跳楼最快能解脱。一下子肝脏被粉碎，死亡窒息。	7
我认为跳楼是快速、准确和无情的	7
我认为从一栋楼里跳出来既快又准确。	7
我认为跳跃是快速而有力的	7
我认为跳起来很难。	7
我觉得跳得很快	7
我还想跳楼	7
我也想从大楼里跳出来。	7
我也想跳。	7
我想跳	7
我也想跳下去	7
北京有烧炭的女孩吗	7
北京有烧煤的女孩吗？	7
北京有个木炭女孩吗？	7
北京有烧煤的女孩吗？	7
你在北京有烧炭的女儿吗。	7
我要跳楼，他们觉得很可笑	7
我要从大楼里跳下去，他们只是觉得很可笑。	7
我会跳，他们只是觉得可笑	7
我要从大楼里跳下来，他们只是认为这很有趣。	7
我要跳下去。他们只是觉得奇怪。	7
我很羡慕那些在家休假的人，这真的。。。我什么都不敢做。真的。我想直接淹死，然后挣扎着往上游。该死的烦人	7
我真羡慕把学校留在家里，真的是。。。。。。我什么都不敢。真的是。我想直接淹死，为游泳而战。母亲不适	7
想在家学习，这是。。。我什么也不敢。真的。想淹死和游泳。无聊的狗屎	7
嫉妒离开家上学我什么都不敢。我真的很想直接溺水，但我想为游泳而战。该死的	7
真羡慕你在家休学……我什么都不会。真是的。想就这样溺水，想挣扎着游泳。他妈的	7
你同意烧炭吗	7
关于燃烧煤炭？	7
木炭？	7
关于燃烧煤炭？	7
约好烧炭吗	7
我该怎么办？你真的要跳进玄武湖吗	7
我该怎么办？我真的要跳到玄武湖吗？	7
我真的需要做什么才能跳到玄武岩湖？	7
阿哈，我真的应该怎么做？跳上千岛湖	7
怎么办呢，真的要去玄武湖吗	7
我听说木炭死亡并不痛苦，我想试一试。	7
我听说煤炭的死亡没有痛苦，我想试试。	7
听到木炭死亡并不痛苦，我想试试。	7
我听说煤没痛就死了。	7
听说木炭死了没有痛苦，我想试一试。	7
有女孩想烧炭吗？如果是，请联系我。只有女孩，只有女孩，只女孩	7
有女孩想烧煤，有什么话请联系我，只有女孩，只有女孩，只有女孩？	7
有没有女孩在烧煤，有什么联系我，只有女孩，只有女孩	7
有没有女孩想烧煤，如果有人与我有联系，只有女孩，只有女孩，只有女孩	7
有烧炭的女孩吗，有的话联系我，只有女孩，只有女孩，只有女孩	7
切断脉搏是不好的，安眠药可能看起来是最可靠的，但它们也会很痛苦。建议在国外实施安乐死。	7
脉搏切断不好，安眠药在视觉上是最可靠的，但也很痛苦。建议在国外安乐死。	7
静脉切割不好，安眠药最明显，但也很痛苦。建议在国外实施安乐死。	7
静脉切除并不好，安眠药是最可靠的，但也很痛苦。建议在国外进行安乐死。	7
脉搏不好，安眠药的目视最可靠，但也有痛苦。建议在国外安乐死。	7
离开去吃晚饭我真的很难过。每次我被误解的时候，我都想抓住别人的衣领，解释三天三夜。但是没有人会听你说什么。他们只相信自己的理解，但这真的很可悲。我现在该怎么办？当我看到有人攀登华山时，我被杀了。我真的想不惜一切代价跳下去。生活可能很美好，但坏的总是我	7
我很难过走路，每次被误解，我都迫不及待地抓住别人的脖子解释三天三夜，但没有人会听你说什么，他们只相信你所理解的，但如果我像以前一样理解呢？我很伤心，当我撞到墙上割腕看到有人爬华山时，我想不惜一切代价跳下去。生活可能很美好，但坏事一直对我来说。	7
我真的很难过，每次我们错了，我都会被人憎恨，我没有抓住别人的衣领来解释三天三夜，但没有人听你说什么，他们只相信他们理解的，但他们像以前一样悲伤吗？撞到墙上，割下手腕，看到有人爬山，生下我渴望的跳跃？生活可能很美好，但坏事总是我。	7
我真的很难过走路，哦，每次我误解它，我都会让别人握住领子来解释三天三夜的事情，但没有人听你说什么，只是他们认为他们理解，但阿，你以前怎么做也很伤心美国国务院	7
去吃饭真的好伤心每次被误会都抓着人家领子解释三天三夜，没人听你的。他们只相信自己的理解，但是啊，很悲伤。怎么又像以前一样了。碰壁割腕看到有人爬华山的时候，我也想忘我地跳下去啊。也许人生是美好的，但不好的一直是我	7
晚饭时，我觉得上吊自杀很痛苦。我改吃安眠药，呵呵	7
食物，我认为挂起来很痛苦，最好吃安眠药，嘻哈	7
吃饭，我觉得挂在上面很痛苦，我还在服用安眠药，嘻哈	7
吃饭，我认为绞刑很痛苦，我还在服用安眠药，哦	7
饭，我觉得吊死是痛苦的，我还是吃安眠药吧，笑眯眯的	7
当我还是个孩子的时候，跳下三层楼梯可以获得的快乐，但当我长大后，我要从几层楼开始？	7
当你还是个孩子的时候，从三级楼梯上跳下来可以获得的快乐，你必须从哪个楼层长大？	7
当你还是个孩子的时候，你可以从三级楼梯上跳下来，当你长大的时候，有多少层楼？	7
当你年轻的时候，从几层楼长大后，你能从第三层楼跳下快乐吗？	7
小时候只要从三段楼梯跳下来就能得到的乐趣，长大后从几楼开始？	7
事实上，我可能是那种放弃自我的人。我就像一个还没有长大的孩子。虽然生活还有希望，但我讨厌现在的生活，找不到伴侣。我是一个堕落的人。我真的很想尽快结束这种生活，但我真的害怕死亡。无论是悬挂还是跳跃都很复杂，谁能帮我	7
事实上，我可以是那种抛弃自己的人，我就像一个小男孩，生活显然很有前途，但我甚至讨厌现在的生活，我找不到伴侣，一个堕落的人，我真的很想很快结束这一生，但我真的很害怕死，如果挂断或跳起来是一个很好的纠葛，谁能帮我？	7
事实上，我可能是那种自我否定的人，我就像一个小孩，一个充满希望的生活，但我讨厌现在的生活，我找不到目标，一个男人跌倒，我真的想很快结束这段生活，但我真的害怕死，我上吊自杀或跳进一个好的纠结，这可以帮助我	7
事实上，我可能是一种自我抛弃，就像小孩子一样，生活中显然有希望，但我讨厌现在的生活，但也找不到对象，一个腐败的人，真的想尽快结束这一生，但死亡真的很可怕，毕竟，它还悬挂着交织在一起的良好跳跃，这可以帮助我	7
其实我可能是自暴自弃啦。我就像一个不大的孩子，生活有希望，却讨厌现在的生活，也找不到对象，一个人堕落，真想早点结束这种生活，但真的怕死。我在烦恼是上吊还是跳舞。谁能帮我。	7
我还想约个人烧炭自杀	7
我还想和谁约会，燃烧煤炭自杀。	7
我也想和谁一起烧木炭自杀	7
我想和某人一起自杀。	7
我也要和某人约定烧炭自杀	7
我可以问一下车里燃烧的木炭会不会爆炸吗	7
汽车燃烧的煤会爆炸吗？	7
拜托，木炭会在车里爆炸	7
车内的煤炭会爆炸吗？	7
请问车上烧炭会不会爆炸？	7
我想打开煤气自杀，但我害怕煤气泄漏和伤害他人。我担心炭烟太大，我不会被发现。我不敢跳楼或洪水上吊自杀。没有横梁，安眠药太痛了。我试过割手腕，但不管用。我还能做什么？	7
我想打开煤气自杀，但我担心煤气泄漏会伤害其他人。我担心他们会发现我燃烧的煤烟太大了。我不敢从大楼里跳出来，也不敢被洪水淹没。我不敢被洪水淹没。我在房间的横梁上没有安眠药。我割腕太痛苦了。我还能做什么？	7
我想用毒气自杀，但我害怕煤气泄漏和其他人。我害怕太大而无法被发现的木炭烟雾。我害怕在没有安眠药的情况下跳跃或淹没水。太痛苦的横梁切割手腕而不尝试对我做什么？	7
我想从气体中自杀，但也害怕气体泄漏和其他人我害怕燃烧煤烟过大我发现我不敢跳下建筑物或沉入悬挂物中。没有睡光药会很痛苦地切断手腕在我能做的一切之后，我尽量不使用它？	7
我在考虑煤气自杀，但是我害怕煤气泄漏会给别人带来灾难。我怕烧炭烟太大被人发现。我有没有跳楼，泡在水里，上吊，没有梁安眠药，试着割腕。我到底该怎么办呢。	7
木炭燃烧很好！但大城市没有碳	7
烧煤很好！但大城市没有碳	7
好木炭！但大城市没有碳	7
燃煤并不坏！但大城市没有碳。	7
烧炭挺好的。但是大城市没有碳	7
从河里或建筑物上跳下	7
跳进河里还是从大楼里跳下来？	7
跳河还是跳？	7
跳上河或建造	7
你跳河还是跳河。	7
上吊是最快的方法。挣扎是无用的，死亡是最干净的	7
最好尽快上吊，战斗是徒劳的，死得最干净。	7
总是挂得最快，战斗而不死亡最干净。	7
或者悬挂最快的斗争是无用的，更干净的死亡	7
上吊会比较快吧挣扎不死最美	7
木炭会死吗	7
烧煤会死吗？	7
木炭会死吗？	7
燃烧煤炭会死吗？	7
烧炭会死吗	7
你吃安眠药吗？有人能告诉我怎么买安眠药吗？我们如何才能收集到致命的数量？安眠药无痛吗？我是个懦弱的人。我不敢死。我羡慕那些能意外死去的人。	7
服用安眠药？有人能告诉我怎么买安眠药吗？如何收集致死量？安眠药不痛吗？我是个胆小鬼。我不敢死。我羡慕那些可能意外死亡的人。	7
你服用安眠药吗？有人能告诉我怎么买安眠药吗？如何收集致命数量？安眠药无痛吗？我是个懦夫。我不敢死。渴望那些可能意外死亡的人。	7
吃安眠药？有人能告诉我如何购买安眠药吗？如何获得致命剂量？安眠药没有疼痛吗？我是个懦夫。我不敢死，我羡慕那些可能意外死亡的人。	7
你要吃安眠药吗。你能告诉我怎么买安眠药吗。怎样才能收集到致死量。安眠药是不是没有痛苦。我是一个懦弱的人。我不敢死。我羡慕能意外死亡的人。	7
这种强效药物的使用方法不适合我。老实说，我不敢站在屋顶上。过了很长时间，我担心我会跳下去半死，因为它只有三层半。	7
这种吃药的方式不适合我，老实说，我不敢站在屋顶上，我害怕在半死的时候跳很长时间，因为只有三层半。	7
这种服用药片的方式不适合我，老实说，我不敢站在我的大楼顶上，我害怕跳很长时间，半死，因为只有三层半。	7
坦率地说，这种药不适合我，我不敢站在屋顶上，很长一段时间我害怕跳，然后半死了，因为只有3.5个。	7
这种猛药的方法不适合我。说实话，我不敢站在我家楼顶上。我怕长了会跳楼。因为那时候还在三层半。	7
有人烧炭吗	7
有人烧煤吗？	7
有人在烧煤吗？	7
没有人烧煤	7
有烧炭的人吗	7
我的肚子疼，我想哭，但我再也出不来了。准备烧炭	7
我肚子疼，想哭，但我不能出去。我准备烧煤了。	7
胃痛，我想哭，但我不能准备烧煤。	7
胃痛我想哭，但不能流到烧煤的地步	7
胃痛想流泪也不出来，准备烧炭吧	7
我希望疼痛是可以转移的。它可以是一个吊坠，一件衣服，一个图腾。我会收集每个人的痛苦，并把它放在我的背包里。然后，我会带着包跳进夏威夷的活火山，烧掉所有的东西	7
我希望痛苦是可以转移的，可以是吊坠，可以是连衣裙，可以是图腾柱，我会收集每个人的痛苦，把它放在我的背包里，然后带着我的包跳到夏威夷的活火山把一切都烧了。	7
我希望疼痛是可以转移的，它可以是一个吊坠，它是一件衣服，它是图腾，我会收集每个人的疼痛，然后把它装进我的背包，然后我带着我的包跳进夏威夷活火山，烧掉一切	7
我希望疼痛是可以转移的东西。项链是一个西红柿，它会收集所有的疼痛，然后把它放在我的包里，然后带着一个袋子跳到夏威夷的一座活火山中，烧毁所有的东西。	7
我希望痛苦是转移的东西它可以是吊坠可以是衣服托特姆我收集所有人的痛苦放进我的背包然后我拿着包跳进夏威夷的活火山燃烧一切	7
当你跳楼时，请振作起来，	7
当你离开大楼时，站起来，	7
跳跃，哄骗，	7
当你跳下建筑物时，发出噪音。	7
跳楼的时候你们就吵啊。	7
要想快乐，就必须从高楼上跳下来	7
你必须从高楼上跳下来才能快乐。	7
为了快乐而从高楼上跳下来	7
从高层建筑跳下以获得幸福	7
跳楼才能得到幸福	7
今天，我们学校一个高三女生跳楼了。我一直觉得下一个跳楼的人是我，我也希望下一个是我。复读生真的很累，真的很疲惫。	7
我们学校有一个高中三年级的女孩今天从大楼里跳了出来，。。。。我一直认为下一个跳下大楼的人是我，我希望下一个是我，重复的学生真的很累，真的很累。	7
今天，我们学校有一个三岁的女孩，她跳了。。。我总是认为下一跳是我，我也希望下一跳就是我，校对真的很累，真的很累。	7
今天有一个高中女生从大楼里跳下来。我一直认为下一次跳跃将是我的，我也希望下一次是我的，学生阅读真的很累，哦，真的很累。	7
我们学校今天高三女生跳楼了。我总觉得下一个跳楼是我，我也希望下一个是我，浪人生真累，真累。	7
跳下悬崖，让任何人都找不到自己的尸体！突然，这么令人羡慕的事情！让他消失在深渊，回归自然！不需要任何遗体追悼会，不需要邻居讨论！我不需要它！我只想默默地离开！	7
从悬崖上跳下来，这样就没有人能找到他的尸体了！突然间，这是一件令人羡慕的事情！让它消失在深渊中，回到大自然！邻居怎么说！我不需要！我只想安静地离开！	7
跳到悬崖上，这样就没有人能找到他的遗骸！突然发生了令人羡慕的事情！愿他消失在深渊中，回归自然！不需要追悼会，邻居们在谈论什么！我不需要它！我只想安静地离开！	7
从深渊中跳下，没有人能找到他们的遗体！突然间，这是一件令人印象深刻的事情！让他死在深渊中，回归大自然！否否否否否否否否否否否否否否否否否否否否否否否否否否否否否否否否否否否否否否否否否否否否否否否否否否否否否否否否否否否否否否否否否否否否否否否否否否否否否否否否否否否否否否否否否否否否否否否否否否否否否否否否否否否否否否否否否否否否否否我只想让你保持沉默！	7
跳下悬崖，谁也找不到自己的遗体！突然这么羡慕！让他在深渊中消失，回归自然！不需要遗体追悼会，邻居的议论什么的！我不需要！我只想默默的离开！	7
从悬崖上跳下来是罕见的。我担心尸体会吓到别人，我不想被人盯着。你可以选择这个	7
很少有人从悬崖上跳下来，因为担心尸体会吓到人，但他们不想被看到，他们可以选择这个[思考]	7
很少有悬崖跳跃害怕尸体害怕人们不想被包围。可以选择这个〔思考〕	7
很少有人会因为害怕身体害怕不想被包围的人而跳出深渊，但你可以选择这样做[思考]	7
很少有跳崖的吧，如果你担心尸体会吓到你，你可以选择这个[思考]	7
我们去吃饭吧，他们都在逼我死。吊死我会吓到别人吗？我能吃100片安眠药吗	7
走在食物旁边，每个人都强迫我死，如果他们挂断电话，喝100片安眠药，他们会吓到其他人吗？	7
吃饭，他们都强迫我死，上吊不会吓到其他人，喝100片安眠药可以吗	7
用大米走路，他们都强迫我死，绞刑不会吓到别人，喝100粒安眠药就好了	7
吃饭，他们都把我逼死，上吊会吓到别人，吃100片安眠药好不好	7
如果你跳楼，你会死得很难看，对吧	7
如果你从一栋楼里跳出来，我应该死得很丑，对吧？	7
跳，它应该死。	7
跳下大楼，丑陋的人必须死	7
跳下去的话，会死得很难看吧	7
我想买一把手术刀	7
他想买一把手术刀	7
想买手术刀吗	7
想买手术刀	7
想买手术刀	7
跳楼真的很残忍，	7
从一栋楼里跳下来真是太残忍了，	7
跳跃真的很残酷，	7
从大楼里跳下来真的很残酷，	7
跳楼真的很残酷	7
打开窗户但不跳下去	7
打开窗户不跳	7
打开窗户而不跳	7
打开窗户，不跳	7
我打开窗户，但没有跳下去	7
我听说安眠药会死，而且需要一段时间才会疼痛。如果剂量足够大，疼痛会很快过去。	7
我听说安眠药死了，过了一段时间才会疼。如果剂量足够大，疼痛会很快消失。	7
