comment	myLabel
想坠楼，寻获四楼以上的窗户是锁死的，把你闪电传送到楼上吧，你准备好了，给我两秒就能跳下	9
想坠楼，发觉六楼以上的窗子是卡住的，把你瞬间推送到楼顶吧，我准备好了，给我两秒便会跳下	9
一年前上吊的时候 就该割得深一点 先深一点 这样就不会有明天 也不会有此后	9
一年前寻死的时候 才该割得厚一点 再长一点 如此就不会有今天 也不会有以后	9
一年前寻死的时候 才该割得浅当然 先厚一点 这样便不能有今天 也不能有年后	9
一年前割腕的时侯 就此割得深当然 再深一点 这样便不能有今天 也不会有以后	9
量子自杀观察顺便，我是永远不即使自射杀掉的，这样国度亦行我自杀掉了，可是在另一个国度你不会自杀我毕竟活着的，怎么办啊，也许死不了了。我自杀了6次却就活着，我要崩解了	9
量子自杀了解呵呵，你是永恒不可能自杀害掉的，这样世界也行你自杀害了，况且在另这个世界你没有被害你还是做梦的，怎么办啊，终究目大吻了。我自杀了6次却都活著，我要崩解了	9
物理自杀认识呵呵，你是永恒不显然自射杀掉的，那个世界也行你自杀死了，可是在另两个国度你不能自尽我还是活著的，怎么办啊，或许搞不好了。我自杀了6次却都做梦，我要崩溃了	9
量子被害观察一下，我是永远不可能自杀害掉的，那个世界还行你自杀死了，不过在另一条世界我不能自尽你还是活着的，怎么办啊，也许搞不好了。我自杀了6次却都活著，我要瓦解了	9
你那时好平静啊，淡然到除非发现自己才站在四楼边缘，也需要毫不犹豫地跳下去	9
你现在好平静啊，平静至如果发现自己就站在一楼边缘，也可以迫不及待地掉下来	9
我今天好平静啊，平静至如果发现自己便站在一楼底端，还可以不假思索地掉下来	9
你今天坏平静啊，平静到若是发现自己便站在六楼顶端，也需要毫不犹豫地跳下去	9
你当年要是跳下去我是不是又不用这么不爽了	9
我彼时若是跳下来我有没有便不必如此难过了	9
你当时要是掉下来我有没有便无须这么难过了	9
我当年假如跳下去你是不是就无需那么难受了	9
好想明天去加班就从从公司的8楼跳下去。。。。。及他们走后。。。。。。可是又好怕她们有阴云[冤枉]	9
坏想今天去加班才从从公司的8楼跳下去。。。。。等他们走后。。。。。。可是再好怕他们有阴霾[委屈]	9
坏想今天去上班便从从公司的8楼掉下去。。。。。等他们走后。。。。。。可是又坏怕她们有阴霾[冤枉]	9
坏想明天去开车才从从公司的8楼跳下去。。。。。及他们走后。。。。。。况且又坏怕自己有阴影[委屈]	9
若是不会那道防盗网，我昨日以有大雾天气在我身上掉下来了，她会不必一辈子就熬在羞愧里	9
要是不会那道防护栏，我昨晚借着冰雹炎热在他眼中掉下去了，他会不会一辈子都活在愧疚里	9
要是没有那道防盗网，我前天借着雷雨天气在他面前跳下去了，我会无法这辈子就养在愧疚里	9
就算不会那道防护栏，你昨天以有雷雨阴雨在她面前跳下来了，他会不能一辈子也熬在悲痛里	9
吗艳羡你，自杀一次才可逃离这个世界，而我，跳楼了两次，都被救回了。[头儿][摊手][摊手]那时网络呼和如此少，我在考虑，明天自杀还要不要寄帖子了。。	9
吗羡慕你，自杀一场又会离开这些国度，而我，自尽了四次，就遭救下了。[老头][老头][老头]现在网路木鲁这么小，我在考虑，下次被害就要不要递微博了。。	9
啊羡慕你，自杀两次又可离开那个国度，但我，自尽了五次，就遭捉住了。[老头][摊手][头儿]那时网络张张如此多，我在注意，明天自杀还要不用发微博了。。	9
啊羡慕你，自杀一次才会离开这种国度，而你，被害了四次，就被救活了。[摊手][摊手][头儿]现在网路木鲁这么小，你在考虑，下次自杀就要不必寄帖子了。。	9
被害过五次，注射胰岛素，烧炭，都遭救了。现在就是很怕我不负责任的死了，能给自己带来苦恼，是否是痛苦无所谓，而已想亡的干净一点。	9
自杀过五次，口服胰岛素，展枝，都被救了。如今而已难怪你不负责任的亡了，会给自己带来闹心，是否是无助没关系，只是想死的干净一点。	9
自杀过四次，注射胰岛素，烧炭，都被救了。那时只是难怪你不负责任的死了，能替自己产生麻烦，有没有无助没关系，只是想死的干净一点。	9
自杀过五次，注射胰岛素，烧炭，就被救了。那时只是难怪你不负责任的亡了，会替别人带来苦恼，有没有悲伤没关系，就是想亡的干净一点。	9
