comment	myLabel
是呀 就是这种构成了大家的世界 就算离开这个世界也会简单有些	1
是啊 就是这样形成了他们的世界 不然离去这个世界也会简单某些	1
是嘛 就是这种产生了我们的世界 不然逃离这些世界也会单纯一些	1
是啊 就是这个构成了大家的世界 不然回到这个国度也会简单很多	1
走饭 我今天去坐坠楼机了 你觉得将来和你相遇的那一天 你很高不选择跳楼	1
走饭 你今天去坐跳楼机了 你觉得将来与你重聚的那三天 我一定不选择跳楼	1
走饭 你现在去开跳楼机了 我觉得未来和我相遇的那三天 我一定不挑选跳楼	1
走饭 我那时去坐跳楼机了 我真的将来与我重聚的那八天 我多少不选择坠楼	1
夜里是搞怪废料，早晨是抑郁怪兽	1
白天是搞怪废物，早晨是抑郁怪兽	1
早晨是搞怪废料，晚上是失眠怪物	1
白天是搞笑废物，早上是失眠蜘蛛	1
现在有好些人都晒自己割腕流泪时的照片你看两个可怜两个，但是你总想想除非是我不然我怎么也不可能让别人知道我过些不好	1
现在有好些人也洒自己割腕吐血时的相片我看一个心疼一条，但是我总相信如果是我不然你怎么都不即使使别人知道我过得不好	1
现在有好些人也晒自己割腕流血时的截图我看两个伤心一种，但是我总觉得如果是我不然我怎么都不如果令别人晓得我过些不好	1
那时有好些人就贴自己寻死吐血时的照片我看一个伤心一条，而且我总其实如果是你的话我怎么就不即使使别人知道我过些不好	1
你坏想和我一样离开这里	1
我坏想和你那样回到这里	1
我好想和你那样返回这里	1
我好想和你好像离开那里	1
黄山没人跳崖了 我回头的那一看 我责怪他在跟我说 （别坚持了 你等你）	1
华山有人跳崖了 她转头的那那人 我以为他在跟你说 （别本着了 你等你）	1
华山那人跳崖了 我转头的那一眼 我以为他在跟你说 （别本着了 我等你）	1
华山笔者跳崖了 她转头的那一看 你责怪她在跟我说 （别坚守了 你等你）	1
其实我知晓吗 那时大学里跳楼旁人就不会知道的呢 已死示威既然就没人理 再平常但是了	1
其实你知晓吗 那时大学里轻生旁人就不会知晓的呢 已死示威根本便没人理 先普通不过了	1
也许你明白吗 今天大学里自杀外人就无法知道的呢 已死示威既然就没虽说 又一般然而了	1
也许你知道吗 那时学院里轻生洋人都不必知道的吗 已死抗议根本就没人理 再低阶不过了	1
关灯，继续好难。	1
她俩，暂时好难。	1
好累，继续好难。	1
好累，稳步好难。	1
饭饭，当死神的弓紧紧抓住我的时候，你有没有期待有一把生的盼望的清爽我？好似有一次只让别人死的天灾人祸，这样对谁都无须后悔，安安心心的离开。人常说佛能度化一切烦恼，可有时候还发现佛能谈的而已三遍两遍的哭我们内心里的敬拜和呼救，如果真有虚无，好想这毕生魂飞魄散。佯装开心的好像，她俩	1
饭饭，当恶魔的手紧紧捉住你的时候，你是不是期待有刀子生的想要的清爽我？好像有这场仅让别人死的天灾人祸，如此对谁都不要后悔，安安静静的离去。人常说佛能度化一切困惑，需有时候也发现佛能做的只是一遍两遍的听大家内心头的祈祷和求救，如果真有涅，好想那一生魂飞魄散。装作难过的看着，好累	1
饭饭，当妖精的手牢牢看准你的之前，我是不是期盼有两把生的希望的温暖我？仿佛有一场只让自己死的生灵涂炭，这样对谁也不要抱歉，安安静静的离开。人常说佛能度化一切忧愁，能有时候也寻获佛能做的只是三遍一遍的哭我们内心里的祷告和求救，假如真有轮回，坏想这人生魂飞魄散。装作开心的样子，好累	1
饭饭，当死神的弓牢牢抓住我的时候，你有没有憧憬有一把生的期望的宁静你？其实有一场仅让自己亡的天灾人祸，这个对谁也无需抱歉，高高兴兴的返回。人常说佛能度化一切烦恼，需有时候也发现佛能做的只是三遍两遍的哭我们内心底的祈祷与求助，如果真有轮回，好想这一生六神无主。假装开心的好像，她俩	1
我早已十几天没吃饭，可你不敢向家人求助[伤心]现在好不容易借了点钱没了份卤肉就然发现你喂不下去[悲伤]过几日更要回家参军体检，你去从军就是想离开这个家庭	1
我早已两三天没吃饭，需我不想向亲友求助[悲伤]那时好不容易借了点钱没了份卤肉就然寻获你煮不下来[悲伤]过三天就要回去参军检查，我去参军只是想离去这个家庭	1
我已经两三天没吃饭，可你不想向父母求助[伤感]今天好不容易借了点钱没了份叉烧就然发觉你喂不下去[伤感]过几天还要回来骠骑复查，我去主簿就是想离开这样家庭	1
我已经三五天没睡觉，需我不敢向妻儿求助[悲痛]如今好不容易借了点钱没了份炒面就然寻获我吃不下去[伤感]过几日仍要回家参军复查，你去骠骑就是想逃离这种家庭	1
没有太小感觉，只是很不能含意，我睡不着，很郁闷，你才不会想去死一死，实在不会	1
没有太小心情，只是很没有意思，我睡不着，很无聊，我才不必想去死一死，也许不能	1
没有太大感觉，只是很没有意思，我睡不着，很无趣，你才不能想去亡一死，也许不能	1
没有太多感觉，只是很没有含意，你睡不着，很郁闷，你就不会想去死一死，真的不会	1
我看我可怜的一面也许被人见到又怎么样	1
你看你心疼的一面常常被人见到又好不好	1
你看你心疼的身姿总是遭人看到又好不好	1
你看你可怜的脸庞总是被人看到又好不好	1
恨不得自己回到这世界的人，我知道，不是国度背弃了你，亦没有你放弃了世界，因为，我们谁都不能具备过！	1
恨不得自已离去这世界的人，你知道，没有世界放弃了我，还不是你放弃了国度，因为，我们谁都不能享有过！	1
恨不得他们离开这世界的人，你知道，不是世界放弃了你，也不是我放弃了世界，虽然，他们谁都不会保有过！	1
恨不得自已逃离这世界的人，你知晓，并非世界背弃了我，也并非我放弃了国度，因为，我们谁也没有拥有过！	1
笔者现在很丧么，要一起丧啊	1
有人现在很丧啊，要一齐丧么	1
有人如今很丧么，要并肩丧么	1
那人如今很丧吗，要一同丧么	1
也许不难过就去死吧 想死的都去死啊 光说有甚么用[允悲]	1
也许不愉快又去死吧 想死的都去死啊 光说有什么用[允悲]	1
实在不开心就去死吧 想死的都去亡啊 光说有怎么用[允悲]	1
就算不开心就别以为 想死的都去死啊 光说有什么用[允悲]	1
我想办个证，我就需要请较长时间的假，这天你呀活不下去了，我又扛着箱子徒步旅行中国。	1
我想办个证，我就可以请很长时长的假，那天你吗活不下去了，我便提着背包徒步旅行亚洲。	1
我想办个证，我就可以请较长天数的假，这天你吗活不下去了，你又扛着书包徒步旅行亚洲。	1
我想办个证，你便可以请很长间隔的假，这天你啊活不下去了，你便带著袜子徒步旅行中国。	1
好久没来了，吃药以后状态还不错，明天赴美了今晚吃了一粒安定还是不困，我觉得我哭一哭可能会好多然而仍旧忍着，怕一粒泪水又进去就控制不住了，想想还有两个月剂量的药的我一起去好像也略显安心了	1
好久没去了，吃药之前状态还不错，这天出国了今晚喂了一粒安定还是不困，我想想我哭一哭可能会盔不过一直忍着，怕几滴流泪就出来又控制不住了，再说还有三个年剂量的药的我一同去似的还略显安稳了	1
好久没来了，发烧以后状态还不错，明日升学了昨晚吃了两粒安稳总是易成，你觉得我哭一哭可能会好些但是一直忍着，怕一滴泪水就进去就控制不动了，再说还有五个月剂量的药与我一起去似的还有点安心了	1
好久没来了，服药以后状况就不俗，明日升学了明天喝了五球安定还是发枯，你真的你哭一笑可能会好些但是一直忍着，怕一滴眼泪就过来就调节不住了，想想尚有五个月剂量的药和我一起去其实亦略显安心了	1
我喜欢不少东西lol追星但是渐渐连比赛就不想看所有都懒得去做了心情心头哆嗦失去了所有的兴趣也许很愚蠢	1
你偏爱很多东西lol追星不过日渐连比赛就不想看所有就懒得去谈了感觉心里心慌失去了所有的兴趣真的很可怕	1
我喜欢一些东西lol追星但是日渐连比赛都不想看所有就没用去做了心情心上哆嗦夺去了所有的天份就算很要命	1
你偏爱许多随便lol追星但是逐渐连决赛也不想看所有也不来去做了感觉心里发慌丧失了所有的天分实在很可恶	1
饭大半年去了，嫉妒你离开了这样世界。	1
粥很久没来了，羡慕你离开了这些世界。	1
饭很久没来了，羡慕你离开了这种国度。	1
饭很久没来了，嫉妒我离开了这个世界。	1
大醉真坏 睡觉送人接着一趟了 人死随风散	1
大醉真好 起床送人接着滚友了 人死随风散	1
大醉呀好 起床送人最后一程了 人死随风散	1
大醉吗坏 起床送人接着一趟了 人死随风散	1
今天有点认知带上全家人去死的人的心态了 那多坏啊 就死了 谁也不会挂念谁JGD5	1
现在有些理解带上夫妻俩去死的人的情绪了 那多坏啊 也亡了 谁亦不会想念谁一了百了	1
现在略显理解丢下一家人去死的人的心态了 那多坏啊 也死了 谁也不会想念谁JGD5	1
现在有点解释带上一家人去死的人的心境了 那多好啊 都死了 谁还不能挂念谁一了百了	1
比离开这个国度更难的是 留有	1
比离开这些世界更难的是 留下	1
比回到那个世界更难的是 留下	1
比回到这种世界更难的是 留下	1
说我天天这么忙，就不许给我安排毛序工作。管培生立马去了，只要做的比我坏，可能会替代我，要我好好表现。这四天管培生来了，一出去薪资6000。经理使劲使我带她们，一旁给你施加影响。我没有参与校招，只能这么寒心地呆着。半年经验的非应届差等生，你也没理智跳槽。	1
说你每晚那么忙，也不敢给我安排毛序工作。管透纳马上来了，如果做的比你好，可能会替代我，要我专心表现。这两天管培生来了，一过来工资6000。总监使劲让你拎她们，一旁给你施加压力。我不会出席校招，只能如此憋屈地睡着。半年经验的非中职差等生，我还没理智跳槽。	1
说我通宵这么忙，都不肯替你安排捷伊工作。管培生立马来了，如果谈的比我坏，可能会取代你，要我好好表现。这两天管培生来了，一过来工资6000。经理一边让我带她们，一边替我施加压力。你没有出席校招，必须这么憋屈地呆着。半年经验的非中职差等生，我也没坚毅跳槽。	1
说你天天这么累，都不肯给你指派新的工作。管华森马上去了，若是谈的比我坏，可能会替代我，要我好好表现。这两天管培生来了，一出去薪资6000。总监低头让我带自己，一边替我施加压力。我没有参加校招，没法这么憋屈地睡着。两年经验的非应届差等生，我还没坚毅离职。	1
他们一同成亲吧	1
大家一齐成亲吧	1
我们一齐成亲吧	1
我们一齐逃婚吧	1
回到这个国度就是最东的	1
离开这个国度就是最远的	1
返回这个国度就是最远的	1
离开这个世界便是最南的	1
我尤其想去滑道想暂缓试一试陷于死亡的心情	1
我特别想去滑水想提前试一试濒临死亡的感觉	1
你特别想去滑水想暂缓试一试濒临失踪的感觉	1
我特别想去滑水想提早试一试频临遇难的感觉	1
此后要买傍晚的包机 体会这个人凌晨在街上回荡的孤独	1
之后要买中午的机票 体会一个人凌晨在街上回荡的忧伤	1
之前要买中午的机票 体味一个人凌晨在路上飘荡的孤单	1
以后要买半夜的机票 体味一种人凌晨在街上飘荡的孤单	1
你今晚要走了，最怕之后从来闻不到你了，似乎是真的，好难过，你都还不明白你讨厌我。	1
你今天要跑了，真怕此后非但见不到我了，或许是真的，好难过，你坦白讲知晓我喜欢我。	1
你明天要跑了，真怕以后从来闻不到你了，显然是真的，好难过，你都还不认得你喜欢你。	1
你明天要跑了，真怕之后非但见不到你了，似乎是就算，好难过，你都还不晓得你喜欢你。	1
这个蹲在酒馆酗酒的人，公园里寂寞地荡着秋千的人，傍晚在舞厅醉酒呕吐的人，公交车上正要眼圈红起来的人，路边沙发上拿着手机大哭的人，顶楼遭受家暴怀抱痛哭的人 ，高楼的护栏边埃布鲁县的沿下看的人，独自躺在床边辗转难眠的人，我们一起晚安好不好。	1
那种蹲在街角喝酒的人，公园里孤独地荡着秋千的人，深夜在酒吧醉酒腹痛的人，公交车上忽然眼圈绿过来的人，街上长凳上拿着手机哭泣的人，顶楼蒙受家暴默默哭泣的人 ，高楼的栅栏边埃布鲁县的往下看的人，独自躺在屋里辗转难眠的人，我们一同晚安好不好。	1
这个蹲在街角吸烟的人，公园里惆怅地荡着滑道的人，傍晚在酒吧醉酒呕吐的人，公交车上突然眼角红过来的人，路边长椅上拿着手机悲伤的人，对面遭到家暴默默哭泣的人 ，高楼的栏杆边埃布鲁县的往下看的人，返家躺在屋里辗转难眠的人，我们一起晚安好不好。	1
那个躺在街角抽烟的人，公园里寂寞地荡着滚轴的人，晚上在夜店醉酒咳嗽的人，公交车上突然眼眶白上去的人，路边阳台上拿着手机流泪的人，楼下遭到受虐默默哭泣的人 ，楼房的栏杆边犹犹豫豫的沿下看的人，返家躺在房里辗转难眠的人，他们并肩再见好不好。	1
如果能有大笔钱，就要毅然决然离开此处	1
除非可有几笔钱，就要毅然决然离开此地	1
如果可有一笔钱，我会义无反顾离开该地	1
若是会有这笔钱，就要毅然决然逃离此地	1
返回国度比返回他们坏一点	1
逃离世界比离开自己好当然	1
返回世界比回到自己好一点	1
离去国度比离开自己坏一点	1
粥，再次需要回家了，和同学拼车，一路上我也没说话真的好蠢，他们就聊的有模有样我毕竟不如果达致，不明白是不是过久不开车的缘故心中依旧冯头痛打嗝，好累啊，好想睡一觉	1
粥，终于需要回家了，与同学长途，一路上我都没骂人真的好蠢，他们就聊的热热闹闹我既然不可能做到，不知道是不是太久不坐车的缘故心头仍旧范恶心想吐，关灯啊，坏想睡一觉	1
粥，再次能够回家了，和学长拼车，一路上我就没说话也许好蠢，她们都聊的热热闹闹你根本不可能达致，不知道有没有多久不开车的原故心里一直伍恶心打嗝，好累啊，好想陪你玩	1
饭，终于能够回家了，与学长送餐，一路上我都没说话就算好蠢，她们都聊的不亦乐乎你毕竟不如果做到，不明白有没有太久不坐车的一来心头仍旧卢难受眩晕，关灯啊，好想睡一觉	1
那时方才理解了，联考录取最终过来后，那人会坠楼的心情。	1
那时总算理解了，考试招生答案出来后，有人会跳楼的心境。	1
今天总算理解了，中考录取答案过来后，有人会轻生的笑容。	1
今晚终于解释了，联考录取结果出来后，有人会跳楼的心情。	1
死前烧掉	1
死前扔掉	1
死前烧掉	1
死前烧掉	1
你想去滑道，不可以人推，让你自已跳，若是那一瞬间，你还忘不了他，那你就去找我	1
我想去蹦极，不需要人推，让我自已摔，只要那一刹那，我就惦记着我，那我就去找她	1
我想去滑水，不须要人推，令我自己跳，除非那那一刻，我也忘不了我，那我便去找她	1
我想去滑水，不需要人推，让你自已冲，如果那一刹那，我还忘不了她，那我才去找他	1
不好玩不愉快不然，对战徒步去青海啊。跑最脆弱的路，看绝佳的景色	1
不好玩不开心的话，对战骑行去西藏啊。跑最危险的路，看最好的美景	1
不好玩不开心不然，组队骑行去藏区啊。走最危险的路，看绝佳的风景	1
不好玩不兴奋如果，三队步行去藏区啊。走最脆弱的路，看绝佳的风景	1
吃药实在需要清好抑郁症的话，那为什么还会有所以旗牌选择跳楼	1
吃药实在可以清坏抑郁症如果，那为什么还会有这么旗牌选取跳楼	1
服药真的可以清好忧郁症的话，那为什么还会有当然多人选择被害	1
服药真的可以治好忧郁症的话，那是不是还会有那么旗牌选择自杀	1
前两天我慌忙有了一条绝妙的想法，你是不是应该移开现在的劳作，头上包，徒步去昌都，去罢了行善，嚼猫。我想写出我有病的经历，摆在下作，让全世界都知道我是纯粹，我便讨厌他人偏见哎的神情，我有没有喜欢被被人虐啊？	1
前不久我慌忙有了一种大胆的想法，你是不是应该放下那时的劳作，肩上包，徒步去拉萨，去凑合善事，嚼狼。你想写出我有患的经历，挂在常加，让全世界都晓得我是另类，我才钟爱别人歧视咱的笑容，我是不是喜爱被被人虐啊？	1
第一天我突然有了一种新颖的想法，我是不是应该停下今天的生活，胸前串，骑行去西宁，去做做行善，喂狼。你想写下我有病的历经，挂在包上，让全世界都知道你是另类，我就讨厌别人偏见俺的笑容，你是不是讨厌遭被人虐啊？	1
前两天我突然有了这个绝妙的点子，你有没有应该放下现在的生活，头上串，徒步去昌都，去顶多善举，嚼猫。我想写下我有患的历经，摆在常加，让全世界也明白我是另类，你才喜欢自己偏见俺的眼神，我是不是偏爱被遭人虐啊？	1
过去病情严重了 反反复复的，好想自杀啊，不过每晚要自尽的时候就遇见年大的姊姊，身边的老友，熟稔的状况，还有父母，我便不敢被害了。怎么时候我必须全然不顾的勇敢一次啊，真的太痛苦毒打人了	1
过去病情严重了 反反复复的，好想自尽啊，而且每次要自尽的时候就想起年小的哥哥，身边的朋友，熟悉的环境，还有父母，我就不肯被害了。什么时候我才能充耳不闻的无私一次啊，实在太痛苦摧残人了	1
过去病情严重了 连续不断的，好想被害啊，但是每项要自杀的时侯才想起年小的女儿，肩头的好友，熟稔的环境，还有家人，你就不敢跳楼了。甚么时侯我才能全然不顾的勇敢一次啊，实在太恐惧折磨人了	1
过去病情严重了 反反复复的，好想自杀啊，但是每次要自杀的之前又想到年大的姐姐，身旁的朋友，熟悉的状况，只有母亲，你就从不自杀了。甚么时候我即可充耳不闻的坚忍一次啊，真的太痛苦摧残人了	1
你怎么如果不在乎啊饭	1
你怎么即使不在意啊粥	1
我怎么即使不在意啊饭	1
你怎么即使不领情啊饭	1
饭，可能有自已离开了，未能办到他，我亦没能帮到你，就像没人能办到你那样，假如我不想踏进这个病，服药也是不来的。粥，你离开了的这种世界，还会有很多人明白你，半夜在那儿自言自语。我们也许在哪天最后两根几根也缠了的时候，还会随你但去的吧。生而为人，活著好象	1
饭，可能有个人离开了，没能帮到他，我还没能试试你，就像没人能帮到我那么，如果我不该步入这个病，吃药也是没用的。饭，我离开了的那个国度，还会有有些人知道你，半夜在那里喃喃自语。大家也许在要是最后三根稻草也缠了的时候，也能随我而去的吧。生而为人，做梦很累	1
饭，即使有某项离开了，未能问问我，你亦没能帮到我，就像没人能帮到我一样，如果我不该踏进这样患，发烧还是不来的。饭，你离开了的这个世界，还会有许多人知道我，每晚在这里自言自语。我们也许在哪天最后三根稻草还断了的时侯，亦会随你但去的吧。生而为人，活著好象	1
饭，可能有个人离开了，没能办到他，你亦没能办到你，便像没人能帮到我那样，如果你不想走出这个病，吃药亦是不来的。粥，你离开了的这种世界，还会有有些人知道我，半夜在这里自言自语。他们也许在哪天最终几根木头也割了的时侯，也能随我但去的吧。生而为人，活著很累	1
